row_id,template,route,topic_slug,state,title,priority,demand_score,competitor_density,busa_overlap,cta_target,subtype,topic_type,already_live,migrated_from_sheet,sheet_row_id,sources,notes
MB-1649,qa-x-state,/qa/medicare-savings-program-massachusetts,medicare-savings-program-massachusetts,MA,Massachusetts Medicare Savings Program (QMB/SLMB/QI) Income Limits 2026,2,,low,slight,screener,qa-state-eligibility,,n,n,,,QA state-eligibility umbrella medicare-savings-program
MB-1650,qa-x-state,/qa/medicare-savings-program-michigan,medicare-savings-program-michigan,MI,Michigan Medicare Savings Program (QMB/SLMB/QI) Income Limits 2026,2,,low,slight,screener,qa-state-eligibility,,n,n,,,QA state-eligibility umbrella medicare-savings-program
MB-1651,qa-x-state,/qa/medicare-savings-program-minnesota,medicare-savings-program-minnesota,MN,Minnesota Medicare Savings Program (QMB/SLMB/QI) Income Limits 2026,2,,low,slight,screener,qa-state-eligibility,,n,n,,,QA state-eligibility umbrella medicare-savings-program
MB-1652,qa-x-state,/qa/medicare-savings-program-missouri,medicare-savings-program-missouri,MO,Missouri Medicare Savings Program (QMB/SLMB/QI) Income Limits 2026,2,,low,slight,screener,qa-state-eligibility,,n,n,,,QA state-eligibility umbrella medicare-savings-program
MB-1653,qa-x-state,/qa/medicare-savings-program-montana,medicare-savings-program-montana,MT,Montana Medicare Savings Program (QMB/SLMB/QI) Income Limits 2026,2,,low,slight,screener,qa-state-eligibility,,n,n,,,QA state-eligibility umbrella medicare-savings-program
MB-1654,qa-x-state,/qa/medicare-savings-program-nebraska,medicare-savings-program-nebraska,NE,Nebraska Medicare Savings Program (QMB/SLMB/QI) Income Limits 2026,2,,low,slight,screener,qa-state-eligibility,,n,n,,,QA state-eligibility umbrella medicare-savings-program
MB-1655,qa-x-state,/qa/medicare-savings-program-nevada,medicare-savings-program-nevada,NV,Nevada Medicare Savings Program (QMB/SLMB/QI) Income Limits 2026,2,,low,slight,screener,qa-state-eligibility,,n,n,,,QA state-eligibility umbrella medicare-savings-program
MB-1656,qa-x-state,/qa/medicare-savings-program-new-hampshire,medicare-savings-program-new-hampshire,NH,New Hampshire Medicare Savings Program (QMB/SLMB/QI) Income Limits 2026,2,,low,slight,screener,qa-state-eligibility,,n,n,,,QA state-eligibility umbrella medicare-savings-program
MB-1657,qa-x-state,/qa/medicare-savings-program-new-jersey,medicare-savings-program-new-jersey,NJ,New Jersey Medicare Savings Program (QMB/SLMB/QI) Income Limits 2026,2,,low,slight,screener,qa-state-eligibility,,n,n,,,QA state-eligibility umbrella medicare-savings-program
MB-1658,qa-x-state,/qa/medicare-savings-program-new-mexico,medicare-savings-program-new-mexico,NM,New Mexico Medicare Savings Program (QMB/SLMB/QI) Income Limits 2026,2,,low,slight,screener,qa-state-eligibility,,n,n,,,QA state-eligibility umbrella medicare-savings-program
MB-1659,qa-x-state,/qa/medicare-savings-program-new-york,medicare-savings-program-new-york,NY,New York Medicare Savings Program (QMB/SLMB/QI) Income Limits 2026,2,,low,slight,screener,qa-state-eligibility,,n,n,,,QA state-eligibility umbrella medicare-savings-program
MB-1660,qa-x-state,/qa/medicare-savings-program-north-dakota,medicare-savings-program-north-dakota,ND,North Dakota Medicare Savings Program (QMB/SLMB/QI) Income Limits 2026,2,,low,slight,screener,qa-state-eligibility,,n,n,,,QA state-eligibility umbrella medicare-savings-program
MB-1661,qa-x-state,/qa/medicare-savings-program-ohio,medicare-savings-program-ohio,OH,Ohio Medicare Savings Program (QMB/SLMB/QI) Income Limits 2026,2,,low,slight,screener,qa-state-eligibility,,n,n,,,QA state-eligibility umbrella medicare-savings-program
MB-1662,qa-x-state,/qa/medicare-savings-program-oklahoma,medicare-savings-program-oklahoma,OK,Oklahoma Medicare Savings Program (QMB/SLMB/QI) Income Limits 2026,2,,low,slight,screener,qa-state-eligibility,,n,n,,,QA state-eligibility umbrella medicare-savings-program
MB-1663,qa-x-state,/qa/medicare-savings-program-oregon,medicare-savings-program-oregon,OR,Oregon Medicare Savings Program (QMB/SLMB/QI) Income Limits 2026,2,,low,slight,screener,qa-state-eligibility,,n,n,,,QA state-eligibility umbrella medicare-savings-program
MB-1664,qa-x-state,/qa/medicare-savings-program-pennsylvania,medicare-savings-program-pennsylvania,PA,Pennsylvania Medicare Savings Program (QMB/SLMB/QI) Income Limits 2026,2,,low,slight,screener,qa-state-eligibility,,n,n,,,QA state-eligibility umbrella medicare-savings-program
MB-1665,qa-x-state,/qa/medicare-savings-program-rhode-island,medicare-savings-program-rhode-island,RI,Rhode Island Medicare Savings Program (QMB/SLMB/QI) Income Limits 2026,2,,low,slight,screener,qa-state-eligibility,,n,n,,,QA state-eligibility umbrella medicare-savings-program
MB-1666,qa-x-state,/qa/medicare-savings-program-south-dakota,medicare-savings-program-south-dakota,SD,South Dakota Medicare Savings Program (QMB/SLMB/QI) Income Limits 2026,2,,low,slight,screener,qa-state-eligibility,,n,n,,,QA state-eligibility umbrella medicare-savings-program
MB-1667,qa-x-state,/qa/medicare-savings-program-texas,medicare-savings-program-texas,TX,Texas Medicare Savings Program (QMB/SLMB/QI) Income Limits 2026,2,,low,slight,screener,qa-state-eligibility,,n,n,,,QA state-eligibility umbrella medicare-savings-program
MB-1668,qa-x-state,/qa/medicare-savings-program-utah,medicare-savings-program-utah,UT,Utah Medicare Savings Program (QMB/SLMB/QI) Income Limits 2026,2,,low,slight,screener,qa-state-eligibility,,n,n,,,QA state-eligibility umbrella medicare-savings-program
MB-1669,qa-x-state,/qa/medicare-savings-program-vermont,medicare-savings-program-vermont,VT,Vermont Medicare Savings Program (QMB/SLMB/QI) Income Limits 2026,2,,low,slight,screener,qa-state-eligibility,,n,n,,,QA state-eligibility umbrella medicare-savings-program
MB-1670,qa-x-state,/qa/medicare-savings-program-washington,medicare-savings-program-washington,WA,Washington Medicare Savings Program (QMB/SLMB/QI) Income Limits 2026,2,,low,slight,screener,qa-state-eligibility,,n,n,,,QA state-eligibility umbrella medicare-savings-program
MB-1671,qa-x-state,/qa/medicare-savings-program-wisconsin,medicare-savings-program-wisconsin,WI,Wisconsin Medicare Savings Program (QMB/SLMB/QI) Income Limits 2026,2,,low,slight,screener,qa-state-eligibility,,n,n,,,QA state-eligibility umbrella medicare-savings-program
MB-1672,qa-x-state,/qa/medicare-savings-program-wyoming,medicare-savings-program-wyoming,WY,Wyoming Medicare Savings Program (QMB/SLMB/QI) Income Limits 2026,2,,low,slight,screener,qa-state-eligibility,,n,n,,,QA state-eligibility umbrella medicare-savings-program
MB-1673,qa-x-state,/qa/state-pharmaceutical-assistance-alaska,state-pharmaceutical-assistance-alaska,AK,Alaska State Pharmaceutical Assistance Program (SPAP) 2026,2,,low,slight,screener,qa-state-eligibility,,n,n,,,QA state-eligibility umbrella state-pharmaceutical-assistance
MB-1674,qa-x-state,/qa/state-pharmaceutical-assistance-arizona,state-pharmaceutical-assistance-arizona,AZ,Arizona State Pharmaceutical Assistance Program (SPAP) 2026,2,,low,slight,screener,qa-state-eligibility,,n,n,,,QA state-eligibility umbrella state-pharmaceutical-assistance
MB-1675,qa-x-state,/qa/state-pharmaceutical-assistance-california,state-pharmaceutical-assistance-california,CA,California State Pharmaceutical Assistance Program (SPAP) 2026,2,,low,slight,screener,qa-state-eligibility,,n,n,,,QA state-eligibility umbrella state-pharmaceutical-assistance
MB-1676,qa-x-state,/qa/state-pharmaceutical-assistance-colorado,state-pharmaceutical-assistance-colorado,CO,Colorado State Pharmaceutical Assistance Program (SPAP) 2026,2,,low,slight,screener,qa-state-eligibility,,n,n,,,QA state-eligibility umbrella state-pharmaceutical-assistance
MB-1677,qa-x-state,/qa/state-pharmaceutical-assistance-connecticut,state-pharmaceutical-assistance-connecticut,CT,Connecticut State Pharmaceutical Assistance Program (SPAP) 2026,2,,low,slight,screener,qa-state-eligibility,,n,n,,,QA state-eligibility umbrella state-pharmaceutical-assistance
MB-1678,qa-x-state,/qa/state-pharmaceutical-assistance-delaware,state-pharmaceutical-assistance-delaware,DE,Delaware State Pharmaceutical Assistance Program (SPAP) 2026,2,,low,slight,screener,qa-state-eligibility,,n,n,,,QA state-eligibility umbrella state-pharmaceutical-assistance
MB-1679,qa-x-state,/qa/state-pharmaceutical-assistance-dc,state-pharmaceutical-assistance-dc,DC,Washington DC State Pharmaceutical Assistance Program (SPAP) 2026,2,,low,slight,screener,qa-state-eligibility,,n,n,,,QA state-eligibility umbrella state-pharmaceutical-assistance
MB-1680,qa-x-state,/qa/state-pharmaceutical-assistance-hawaii,state-pharmaceutical-assistance-hawaii,HI,Hawaii State Pharmaceutical Assistance Program (SPAP) 2026,2,,low,slight,screener,qa-state-eligibility,,n,n,,,QA state-eligibility umbrella state-pharmaceutical-assistance
MB-1681,qa-x-state,/qa/state-pharmaceutical-assistance-idaho,state-pharmaceutical-assistance-idaho,ID,Idaho State Pharmaceutical Assistance Program (SPAP) 2026,2,,low,slight,screener,qa-state-eligibility,,n,n,,,QA state-eligibility umbrella state-pharmaceutical-assistance
MB-1682,qa-x-state,/qa/state-pharmaceutical-assistance-illinois,state-pharmaceutical-assistance-illinois,IL,Illinois State Pharmaceutical Assistance Program (SPAP) 2026,2,,low,slight,screener,qa-state-eligibility,,n,n,,,QA state-eligibility umbrella state-pharmaceutical-assistance
MB-1683,qa-x-state,/qa/state-pharmaceutical-assistance-indiana,state-pharmaceutical-assistance-indiana,IN,Indiana State Pharmaceutical Assistance Program (SPAP) 2026,2,,low,slight,screener,qa-state-eligibility,,n,n,,,QA state-eligibility umbrella state-pharmaceutical-assistance
MB-1684,qa-x-state,/qa/state-pharmaceutical-assistance-iowa,state-pharmaceutical-assistance-iowa,IA,Iowa State Pharmaceutical Assistance Program (SPAP) 2026,2,,low,slight,screener,qa-state-eligibility,,n,n,,,QA state-eligibility umbrella state-pharmaceutical-assistance
MB-1685,qa-x-state,/qa/state-pharmaceutical-assistance-kansas,state-pharmaceutical-assistance-kansas,KS,Kansas State Pharmaceutical Assistance Program (SPAP) 2026,2,,low,slight,screener,qa-state-eligibility,,n,n,,,QA state-eligibility umbrella state-pharmaceutical-assistance
MB-1686,qa-x-state,/qa/state-pharmaceutical-assistance-maine,state-pharmaceutical-assistance-maine,ME,Maine State Pharmaceutical Assistance Program (SPAP) 2026,2,,low,slight,screener,qa-state-eligibility,,n,n,,,QA state-eligibility umbrella state-pharmaceutical-assistance
MB-1687,qa-x-state,/qa/state-pharmaceutical-assistance-maryland,state-pharmaceutical-assistance-maryland,MD,Maryland State Pharmaceutical Assistance Program (SPAP) 2026,2,,low,slight,screener,qa-state-eligibility,,n,n,,,QA state-eligibility umbrella state-pharmaceutical-assistance
MB-1688,qa-x-state,/qa/state-pharmaceutical-assistance-massachusetts,state-pharmaceutical-assistance-massachusetts,MA,Massachusetts State Pharmaceutical Assistance Program (SPAP) 2026,2,,low,slight,screener,qa-state-eligibility,,n,n,,,QA state-eligibility umbrella state-pharmaceutical-assistance
MB-1689,qa-x-state,/qa/state-pharmaceutical-assistance-michigan,state-pharmaceutical-assistance-michigan,MI,Michigan State Pharmaceutical Assistance Program (SPAP) 2026,2,,low,slight,screener,qa-state-eligibility,,n,n,,,QA state-eligibility umbrella state-pharmaceutical-assistance
MB-1690,qa-x-state,/qa/state-pharmaceutical-assistance-minnesota,state-pharmaceutical-assistance-minnesota,MN,Minnesota State Pharmaceutical Assistance Program (SPAP) 2026,2,,low,slight,screener,qa-state-eligibility,,n,n,,,QA state-eligibility umbrella state-pharmaceutical-assistance
MB-1691,qa-x-state,/qa/state-pharmaceutical-assistance-missouri,state-pharmaceutical-assistance-missouri,MO,Missouri State Pharmaceutical Assistance Program (SPAP) 2026,2,,low,slight,screener,qa-state-eligibility,,n,n,,,QA state-eligibility umbrella state-pharmaceutical-assistance
MB-1692,qa-x-state,/qa/state-pharmaceutical-assistance-montana,state-pharmaceutical-assistance-montana,MT,Montana State Pharmaceutical Assistance Program (SPAP) 2026,2,,low,slight,screener,qa-state-eligibility,,n,n,,,QA state-eligibility umbrella state-pharmaceutical-assistance
MB-1693,qa-x-state,/qa/state-pharmaceutical-assistance-nebraska,state-pharmaceutical-assistance-nebraska,NE,Nebraska State Pharmaceutical Assistance Program (SPAP) 2026,2,,low,slight,screener,qa-state-eligibility,,n,n,,,QA state-eligibility umbrella state-pharmaceutical-assistance
MB-1694,qa-x-state,/qa/state-pharmaceutical-assistance-nevada,state-pharmaceutical-assistance-nevada,NV,Nevada State Pharmaceutical Assistance Program (SPAP) 2026,2,,low,slight,screener,qa-state-eligibility,,n,n,,,QA state-eligibility umbrella state-pharmaceutical-assistance
MB-1695,qa-x-state,/qa/state-pharmaceutical-assistance-new-hampshire,state-pharmaceutical-assistance-new-hampshire,NH,New Hampshire State Pharmaceutical Assistance Program (SPAP) 2026,2,,low,slight,screener,qa-state-eligibility,,n,n,,,QA state-eligibility umbrella state-pharmaceutical-assistance
MB-1696,qa-x-state,/qa/state-pharmaceutical-assistance-new-jersey,state-pharmaceutical-assistance-new-jersey,NJ,New Jersey State Pharmaceutical Assistance Program (SPAP) 2026,2,,low,slight,screener,qa-state-eligibility,,n,n,,,QA state-eligibility umbrella state-pharmaceutical-assistance
MB-1697,qa-x-state,/qa/state-pharmaceutical-assistance-new-mexico,state-pharmaceutical-assistance-new-mexico,NM,New Mexico State Pharmaceutical Assistance Program (SPAP) 2026,2,,low,slight,screener,qa-state-eligibility,,n,n,,,QA state-eligibility umbrella state-pharmaceutical-assistance
MB-1698,qa-x-state,/qa/state-pharmaceutical-assistance-new-york,state-pharmaceutical-assistance-new-york,NY,New York State Pharmaceutical Assistance Program (SPAP) 2026,2,,low,slight,screener,qa-state-eligibility,,n,n,,,QA state-eligibility umbrella state-pharmaceutical-assistance
MB-1699,qa-x-state,/qa/state-pharmaceutical-assistance-north-dakota,state-pharmaceutical-assistance-north-dakota,ND,North Dakota State Pharmaceutical Assistance Program (SPAP) 2026,2,,low,slight,screener,qa-state-eligibility,,n,n,,,QA state-eligibility umbrella state-pharmaceutical-assistance
MB-1700,qa-x-state,/qa/state-pharmaceutical-assistance-ohio,state-pharmaceutical-assistance-ohio,OH,Ohio State Pharmaceutical Assistance Program (SPAP) 2026,2,,low,slight,screener,qa-state-eligibility,,n,n,,,QA state-eligibility umbrella state-pharmaceutical-assistance
MB-1701,qa-x-state,/qa/state-pharmaceutical-assistance-oklahoma,state-pharmaceutical-assistance-oklahoma,OK,Oklahoma State Pharmaceutical Assistance Program (SPAP) 2026,2,,low,slight,screener,qa-state-eligibility,,n,n,,,QA state-eligibility umbrella state-pharmaceutical-assistance
MB-1702,qa-x-state,/qa/state-pharmaceutical-assistance-oregon,state-pharmaceutical-assistance-oregon,OR,Oregon State Pharmaceutical Assistance Program (SPAP) 2026,2,,low,slight,screener,qa-state-eligibility,,n,n,,,QA state-eligibility umbrella state-pharmaceutical-assistance
MB-1703,qa-x-state,/qa/state-pharmaceutical-assistance-pennsylvania,state-pharmaceutical-assistance-pennsylvania,PA,Pennsylvania State Pharmaceutical Assistance Program (SPAP) 2026,2,,low,slight,screener,qa-state-eligibility,,n,n,,,QA state-eligibility umbrella state-pharmaceutical-assistance
MB-1704,qa-x-state,/qa/state-pharmaceutical-assistance-rhode-island,state-pharmaceutical-assistance-rhode-island,RI,Rhode Island State Pharmaceutical Assistance Program (SPAP) 2026,2,,low,slight,screener,qa-state-eligibility,,n,n,,,QA state-eligibility umbrella state-pharmaceutical-assistance
MB-1705,qa-x-state,/qa/state-pharmaceutical-assistance-south-dakota,state-pharmaceutical-assistance-south-dakota,SD,South Dakota State Pharmaceutical Assistance Program (SPAP) 2026,2,,low,slight,screener,qa-state-eligibility,,n,n,,,QA state-eligibility umbrella state-pharmaceutical-assistance
MB-1706,qa-x-state,/qa/state-pharmaceutical-assistance-texas,state-pharmaceutical-assistance-texas,TX,Texas State Pharmaceutical Assistance Program (SPAP) 2026,2,,low,slight,screener,qa-state-eligibility,,n,n,,,QA state-eligibility umbrella state-pharmaceutical-assistance
MB-1707,qa-x-state,/qa/state-pharmaceutical-assistance-utah,state-pharmaceutical-assistance-utah,UT,Utah State Pharmaceutical Assistance Program (SPAP) 2026,2,,low,slight,screener,qa-state-eligibility,,n,n,,,QA state-eligibility umbrella state-pharmaceutical-assistance
MB-1708,qa-x-state,/qa/state-pharmaceutical-assistance-vermont,state-pharmaceutical-assistance-vermont,VT,Vermont State Pharmaceutical Assistance Program (SPAP) 2026,2,,low,slight,screener,qa-state-eligibility,,n,n,,,QA state-eligibility umbrella state-pharmaceutical-assistance
MB-1709,qa-x-state,/qa/state-pharmaceutical-assistance-washington,state-pharmaceutical-assistance-washington,WA,Washington State Pharmaceutical Assistance Program (SPAP) 2026,2,,low,slight,screener,qa-state-eligibility,,n,n,,,QA state-eligibility umbrella state-pharmaceutical-assistance
MB-1710,qa-x-state,/qa/state-pharmaceutical-assistance-wisconsin,state-pharmaceutical-assistance-wisconsin,WI,Wisconsin State Pharmaceutical Assistance Program (SPAP) 2026,2,,low,slight,screener,qa-state-eligibility,,n,n,,,QA state-eligibility umbrella state-pharmaceutical-assistance
MB-1711,qa-x-state,/qa/state-pharmaceutical-assistance-wyoming,state-pharmaceutical-assistance-wyoming,WY,Wyoming State Pharmaceutical Assistance Program (SPAP) 2026,2,,low,slight,screener,qa-state-eligibility,,n,n,,,QA state-eligibility umbrella state-pharmaceutical-assistance
MB-1712,qa-x-state,/qa/immigrant-medicaid-alaska,immigrant-medicaid-alaska,AK,Alaska Immigrant Medicaid Eligibility 2026,2,,low,slight,screener,qa-state-eligibility,,n,n,,,QA state-eligibility umbrella immigrant-medicaid
MB-1713,qa-x-state,/qa/immigrant-medicaid-arizona,immigrant-medicaid-arizona,AZ,Arizona Immigrant Medicaid Eligibility 2026,2,,low,slight,screener,qa-state-eligibility,,n,n,,,QA state-eligibility umbrella immigrant-medicaid
MB-1714,qa-x-state,/qa/immigrant-medicaid-california,immigrant-medicaid-california,CA,California Immigrant Medicaid Eligibility 2026,2,,low,slight,screener,qa-state-eligibility,,n,n,,,QA state-eligibility umbrella immigrant-medicaid
MB-1715,qa-x-state,/qa/immigrant-medicaid-colorado,immigrant-medicaid-colorado,CO,Colorado Immigrant Medicaid Eligibility 2026,2,,low,slight,screener,qa-state-eligibility,,n,n,,,QA state-eligibility umbrella immigrant-medicaid
MB-1716,qa-x-state,/qa/immigrant-medicaid-connecticut,immigrant-medicaid-connecticut,CT,Connecticut Immigrant Medicaid Eligibility 2026,2,,low,slight,screener,qa-state-eligibility,,n,n,,,QA state-eligibility umbrella immigrant-medicaid
MB-1717,qa-x-state,/qa/immigrant-medicaid-delaware,immigrant-medicaid-delaware,DE,Delaware Immigrant Medicaid Eligibility 2026,2,,low,slight,screener,qa-state-eligibility,,n,n,,,QA state-eligibility umbrella immigrant-medicaid
MB-1718,qa-x-state,/qa/immigrant-medicaid-dc,immigrant-medicaid-dc,DC,Washington DC Immigrant Medicaid Eligibility 2026,2,,low,slight,screener,qa-state-eligibility,,n,n,,,QA state-eligibility umbrella immigrant-medicaid
MB-1719,qa-x-state,/qa/immigrant-medicaid-hawaii,immigrant-medicaid-hawaii,HI,Hawaii Immigrant Medicaid Eligibility 2026,2,,low,slight,screener,qa-state-eligibility,,n,n,,,QA state-eligibility umbrella immigrant-medicaid
MB-1720,qa-x-state,/qa/immigrant-medicaid-idaho,immigrant-medicaid-idaho,ID,Idaho Immigrant Medicaid Eligibility 2026,2,,low,slight,screener,qa-state-eligibility,,n,n,,,QA state-eligibility umbrella immigrant-medicaid
MB-1721,qa-x-state,/qa/immigrant-medicaid-illinois,immigrant-medicaid-illinois,IL,Illinois Immigrant Medicaid Eligibility 2026,2,,low,slight,screener,qa-state-eligibility,,n,n,,,QA state-eligibility umbrella immigrant-medicaid
MB-1722,qa-x-state,/qa/immigrant-medicaid-indiana,immigrant-medicaid-indiana,IN,Indiana Immigrant Medicaid Eligibility 2026,2,,low,slight,screener,qa-state-eligibility,,n,n,,,QA state-eligibility umbrella immigrant-medicaid
MB-1723,qa-x-state,/qa/immigrant-medicaid-iowa,immigrant-medicaid-iowa,IA,Iowa Immigrant Medicaid Eligibility 2026,2,,low,slight,screener,qa-state-eligibility,,n,n,,,QA state-eligibility umbrella immigrant-medicaid
MB-1724,qa-x-state,/qa/immigrant-medicaid-kansas,immigrant-medicaid-kansas,KS,Kansas Immigrant Medicaid Eligibility 2026,2,,low,slight,screener,qa-state-eligibility,,n,n,,,QA state-eligibility umbrella immigrant-medicaid
MB-1725,qa-x-state,/qa/immigrant-medicaid-maine,immigrant-medicaid-maine,ME,Maine Immigrant Medicaid Eligibility 2026,2,,low,slight,screener,qa-state-eligibility,,n,n,,,QA state-eligibility umbrella immigrant-medicaid
MB-1726,qa-x-state,/qa/immigrant-medicaid-maryland,immigrant-medicaid-maryland,MD,Maryland Immigrant Medicaid Eligibility 2026,2,,low,slight,screener,qa-state-eligibility,,n,n,,,QA state-eligibility umbrella immigrant-medicaid
MB-1727,qa-x-state,/qa/immigrant-medicaid-massachusetts,immigrant-medicaid-massachusetts,MA,Massachusetts Immigrant Medicaid Eligibility 2026,2,,low,slight,screener,qa-state-eligibility,,n,n,,,QA state-eligibility umbrella immigrant-medicaid
MB-1728,qa-x-state,/qa/immigrant-medicaid-michigan,immigrant-medicaid-michigan,MI,Michigan Immigrant Medicaid Eligibility 2026,2,,low,slight,screener,qa-state-eligibility,,n,n,,,QA state-eligibility umbrella immigrant-medicaid
MB-1729,qa-x-state,/qa/immigrant-medicaid-minnesota,immigrant-medicaid-minnesota,MN,Minnesota Immigrant Medicaid Eligibility 2026,2,,low,slight,screener,qa-state-eligibility,,n,n,,,QA state-eligibility umbrella immigrant-medicaid
MB-1730,qa-x-state,/qa/immigrant-medicaid-missouri,immigrant-medicaid-missouri,MO,Missouri Immigrant Medicaid Eligibility 2026,2,,low,slight,screener,qa-state-eligibility,,n,n,,,QA state-eligibility umbrella immigrant-medicaid
MB-1731,qa-x-state,/qa/immigrant-medicaid-montana,immigrant-medicaid-montana,MT,Montana Immigrant Medicaid Eligibility 2026,2,,low,slight,screener,qa-state-eligibility,,n,n,,,QA state-eligibility umbrella immigrant-medicaid
MB-1732,qa-x-state,/qa/immigrant-medicaid-nebraska,immigrant-medicaid-nebraska,NE,Nebraska Immigrant Medicaid Eligibility 2026,2,,low,slight,screener,qa-state-eligibility,,n,n,,,QA state-eligibility umbrella immigrant-medicaid
MB-1733,qa-x-state,/qa/immigrant-medicaid-nevada,immigrant-medicaid-nevada,NV,Nevada Immigrant Medicaid Eligibility 2026,2,,low,slight,screener,qa-state-eligibility,,n,n,,,QA state-eligibility umbrella immigrant-medicaid
MB-1734,qa-x-state,/qa/immigrant-medicaid-new-hampshire,immigrant-medicaid-new-hampshire,NH,New Hampshire Immigrant Medicaid Eligibility 2026,2,,low,slight,screener,qa-state-eligibility,,n,n,,,QA state-eligibility umbrella immigrant-medicaid
MB-1735,qa-x-state,/qa/immigrant-medicaid-new-jersey,immigrant-medicaid-new-jersey,NJ,New Jersey Immigrant Medicaid Eligibility 2026,2,,low,slight,screener,qa-state-eligibility,,n,n,,,QA state-eligibility umbrella immigrant-medicaid
MB-1736,qa-x-state,/qa/immigrant-medicaid-new-mexico,immigrant-medicaid-new-mexico,NM,New Mexico Immigrant Medicaid Eligibility 2026,2,,low,slight,screener,qa-state-eligibility,,n,n,,,QA state-eligibility umbrella immigrant-medicaid
MB-1737,qa-x-state,/qa/immigrant-medicaid-new-york,immigrant-medicaid-new-york,NY,New York Immigrant Medicaid Eligibility 2026,2,,low,slight,screener,qa-state-eligibility,,n,n,,,QA state-eligibility umbrella immigrant-medicaid
MB-1738,qa-x-state,/qa/immigrant-medicaid-north-dakota,immigrant-medicaid-north-dakota,ND,North Dakota Immigrant Medicaid Eligibility 2026,2,,low,slight,screener,qa-state-eligibility,,n,n,,,QA state-eligibility umbrella immigrant-medicaid
MB-1739,qa-x-state,/qa/immigrant-medicaid-ohio,immigrant-medicaid-ohio,OH,Ohio Immigrant Medicaid Eligibility 2026,2,,low,slight,screener,qa-state-eligibility,,n,n,,,QA state-eligibility umbrella immigrant-medicaid
MB-1740,qa-x-state,/qa/immigrant-medicaid-oklahoma,immigrant-medicaid-oklahoma,OK,Oklahoma Immigrant Medicaid Eligibility 2026,2,,low,slight,screener,qa-state-eligibility,,n,n,,,QA state-eligibility umbrella immigrant-medicaid
MB-1741,qa-x-state,/qa/immigrant-medicaid-oregon,immigrant-medicaid-oregon,OR,Oregon Immigrant Medicaid Eligibility 2026,2,,low,slight,screener,qa-state-eligibility,,n,n,,,QA state-eligibility umbrella immigrant-medicaid
MB-1742,qa-x-state,/qa/immigrant-medicaid-pennsylvania,immigrant-medicaid-pennsylvania,PA,Pennsylvania Immigrant Medicaid Eligibility 2026,2,,low,slight,screener,qa-state-eligibility,,n,n,,,QA state-eligibility umbrella immigrant-medicaid
MB-1743,qa-x-state,/qa/immigrant-medicaid-rhode-island,immigrant-medicaid-rhode-island,RI,Rhode Island Immigrant Medicaid Eligibility 2026,2,,low,slight,screener,qa-state-eligibility,,n,n,,,QA state-eligibility umbrella immigrant-medicaid
MB-1744,qa-x-state,/qa/immigrant-medicaid-south-dakota,immigrant-medicaid-south-dakota,SD,South Dakota Immigrant Medicaid Eligibility 2026,2,,low,slight,screener,qa-state-eligibility,,n,n,,,QA state-eligibility umbrella immigrant-medicaid
MB-1745,qa-x-state,/qa/immigrant-medicaid-texas,immigrant-medicaid-texas,TX,Texas Immigrant Medicaid Eligibility 2026,2,,low,slight,screener,qa-state-eligibility,,n,n,,,QA state-eligibility umbrella immigrant-medicaid
MB-1746,qa-x-state,/qa/immigrant-medicaid-utah,immigrant-medicaid-utah,UT,Utah Immigrant Medicaid Eligibility 2026,2,,low,slight,screener,qa-state-eligibility,,n,n,,,QA state-eligibility umbrella immigrant-medicaid
MB-1747,qa-x-state,/qa/immigrant-medicaid-vermont,immigrant-medicaid-vermont,VT,Vermont Immigrant Medicaid Eligibility 2026,2,,low,slight,screener,qa-state-eligibility,,n,n,,,QA state-eligibility umbrella immigrant-medicaid
