row_id,template,route,topic_slug,state,title,priority,demand_score,competitor_density,busa_overlap,cta_target,subtype,topic_type,already_live,migrated_from_sheet,sheet_row_id,sources,notes
MB-0572,qa-x-state,/qa/pregnancy-medicaid-tennessee,pregnancy-medicaid-tennessee,TN,Tennessee Pregnancy Medicaid Eligibility 2026,1,,low,slight,screener,qa-state-eligibility,,n,n,,,QA state-eligibility umbrella pregnancy-medicaid
MB-0573,qa-x-state,/qa/pregnancy-medicaid-virginia,pregnancy-medicaid-virginia,VA,Virginia Pregnancy Medicaid Eligibility 2026,1,,low,slight,screener,qa-state-eligibility,,n,n,,,QA state-eligibility umbrella pregnancy-medicaid
MB-0574,qa-x-state,/qa/pregnancy-medicaid-west-virginia,pregnancy-medicaid-west-virginia,WV,West Virginia Pregnancy Medicaid Eligibility 2026,1,,low,slight,screener,qa-state-eligibility,,n,n,,,QA state-eligibility umbrella pregnancy-medicaid
MB-0575,qa-x-state,/qa/retroactive-medicaid-alabama,retroactive-medicaid-alabama,AL,Alabama Retroactive Medicaid 2026,1,,low,slight,screener,qa-state-eligibility,,n,n,,,QA state-eligibility umbrella retroactive-medicaid
MB-0576,qa-x-state,/qa/retroactive-medicaid-arkansas,retroactive-medicaid-arkansas,AR,Arkansas Retroactive Medicaid 2026,1,,low,slight,screener,qa-state-eligibility,,n,n,,,QA state-eligibility umbrella retroactive-medicaid
MB-0577,qa-x-state,/qa/retroactive-medicaid-florida,retroactive-medicaid-florida,FL,Florida Retroactive Medicaid 2026,1,,low,slight,screener,qa-state-eligibility,,n,n,,,QA state-eligibility umbrella retroactive-medicaid
MB-0578,qa-x-state,/qa/retroactive-medicaid-georgia,retroactive-medicaid-georgia,GA,Georgia Retroactive Medicaid 2026,1,,low,slight,screener,qa-state-eligibility,,n,n,,,QA state-eligibility umbrella retroactive-medicaid
MB-0579,qa-x-state,/qa/retroactive-medicaid-kentucky,retroactive-medicaid-kentucky,KY,Kentucky Retroactive Medicaid 2026,1,,low,slight,screener,qa-state-eligibility,,n,n,,,QA state-eligibility umbrella retroactive-medicaid
MB-0580,qa-x-state,/qa/retroactive-medicaid-louisiana,retroactive-medicaid-louisiana,LA,Louisiana Retroactive Medicaid 2026,1,,low,slight,screener,qa-state-eligibility,,n,n,,,QA state-eligibility umbrella retroactive-medicaid
MB-0581,qa-x-state,/qa/retroactive-medicaid-mississippi,retroactive-medicaid-mississippi,MS,Mississippi Retroactive Medicaid 2026,1,,low,slight,screener,qa-state-eligibility,,n,n,,,QA state-eligibility umbrella retroactive-medicaid
MB-0582,qa-x-state,/qa/retroactive-medicaid-north-carolina,retroactive-medicaid-north-carolina,NC,North Carolina Retroactive Medicaid 2026,1,,low,slight,screener,qa-state-eligibility,,n,n,,,QA state-eligibility umbrella retroactive-medicaid
MB-0583,qa-x-state,/qa/retroactive-medicaid-south-carolina,retroactive-medicaid-south-carolina,SC,South Carolina Retroactive Medicaid 2026,1,,low,slight,screener,qa-state-eligibility,,n,n,,,QA state-eligibility umbrella retroactive-medicaid
MB-0584,qa-x-state,/qa/retroactive-medicaid-tennessee,retroactive-medicaid-tennessee,TN,Tennessee Retroactive Medicaid 2026,1,,low,slight,screener,qa-state-eligibility,,n,n,,,QA state-eligibility umbrella retroactive-medicaid
MB-0585,qa-x-state,/qa/retroactive-medicaid-virginia,retroactive-medicaid-virginia,VA,Virginia Retroactive Medicaid 2026,1,,low,slight,screener,qa-state-eligibility,,n,n,,,QA state-eligibility umbrella retroactive-medicaid
MB-0586,qa-x-state,/qa/retroactive-medicaid-west-virginia,retroactive-medicaid-west-virginia,WV,West Virginia Retroactive Medicaid 2026,1,,low,slight,screener,qa-state-eligibility,,n,n,,,QA state-eligibility umbrella retroactive-medicaid
MB-0587,track-d,/medicaid-income-limits/alabama,alabama,AL,Alabama Medicaid Income Limits 2026,1,,medium,heavy,screener,qa-state-eligibility,,n,n,,"medicaid.alabama.gov,kff",Track D Medicaid factory (SE prioritized). Reroute to Track D /medicaid-income-limits/alabama.
MB-0588,track-d,/medicaid-income-limits/alaska,alaska,AK,Alaska Medicaid Income Limits 2026,1,,medium,heavy,screener,qa-state-eligibility,,n,n,,"alaska.gov/dhss,kff",Track D Medicaid factory. Reroute to Track D /medicaid-income-limits/alaska.
MB-0589,track-d,/medicaid-income-limits/arizona,arizona,AZ,Arizona AHCCCS Income Limits 2026,1,,medium,heavy,screener,qa-state-eligibility,,n,y,CU-052|CU-053|CU-055|CU-056|CU-115,"azahcccs.gov,kff",Track D Medicaid factory. Reroute to Track D /medicaid-income-limits/arizona. AHCCCS brand variant.
MB-0590,track-d,/medicaid-income-limits/arkansas,arkansas,AR,Arkansas ARHOME Income Limits 2026,1,,medium,heavy,screener,qa-state-eligibility,,n,n,,"humanservices.arkansas.gov,kff",Track D Medicaid factory (SE prioritized). Reroute to Track D /medicaid-income-limits/arkansas. ARHOME brand variant.
MB-0591,track-d,/medicaid-income-limits/california,california,CA,California Medi-Cal Income Limits 2026,1,,high,heavy,screener,qa-state-eligibility,,n,y,CU-047|CU-048|CU-050|CU-051|CU-109,"dhcs.ca.gov,coveredca,kff",Track D Medicaid factory. Reroute to Track D /medicaid-income-limits/california. Medi-Cal brand variant.
MB-0592,track-d,/medicaid-income-limits/colorado,colorado,CO,Colorado Medicaid Income Limits 2026,1,,medium,heavy,screener,qa-state-eligibility,,n,y,CU-085|CU-086,"hcpf.colorado.gov,kff",Track D Medicaid factory. Reroute to Track D /medicaid-income-limits/colorado.
MB-0593,track-d,/medicaid-income-limits/connecticut,connecticut,CT,Connecticut HUSKY Income Limits 2026,1,,medium,heavy,screener,qa-state-eligibility,,n,n,,"portal.ct.gov/dss,kff",Track D Medicaid factory. Reroute to Track D /medicaid-income-limits/connecticut. HUSKY brand variant.
MB-0594,track-d,/medicaid-income-limits/delaware,delaware,DE,Delaware Medicaid Income Limits 2026,1,,medium,heavy,screener,qa-state-eligibility,,n,n,,"dhss.delaware.gov,kff",Track D Medicaid factory. Reroute to Track D /medicaid-income-limits/delaware.
MB-0595,track-d,/medicaid-income-limits/dc,dc,DC,Washington DC Medicaid Income Limits 2026,1,,low,slight,screener,qa-state-eligibility,,n,n,,"dhcf.dc.gov,kff",Track D Medicaid factory. Reroute to Track D /medicaid-income-limits/dc. 51st jurisdiction.
MB-0596,track-d,/medicaid-income-limits/florida,florida,FL,Florida Medicaid Income Limits 2026,1,,high,heavy,screener,qa-state-eligibility,,n,y,CU-032|CU-033|CU-035|CU-036|CU-108,"ahca.myflorida.com,kff",Track D Medicaid factory (SE prioritized). Reroute to Track D /medicaid-income-limits/florida.
MB-0597,track-d,/medicaid-income-limits/georgia,georgia,GA,Georgia Pathways Income Limits 2026,1,,medium,heavy,screener,qa-state-eligibility,,n,y,CU-037|CU-038|CU-040|CU-041,"medicaid.georgia.gov,kff",Track D Medicaid factory (SE prioritized). Reroute to Track D /medicaid-income-limits/georgia. Pathways brand variant.
MB-0598,track-d,/medicaid-income-limits/hawaii,hawaii,HI,Hawaii Med-QUEST Income Limits 2026,1,,low,heavy,screener,qa-state-eligibility,,n,n,,"medquest.hawaii.gov,kff",Track D Medicaid factory. Reroute to Track D /medicaid-income-limits/hawaii. Med-QUEST brand variant.
MB-0599,track-d,/medicaid-income-limits/idaho,idaho,ID,Idaho Medicaid Income Limits 2026,1,,medium,heavy,screener,qa-state-eligibility,,n,n,,"healthandwelfare.idaho.gov,kff",Track D Medicaid factory. Reroute to Track D /medicaid-income-limits/idaho.
MB-0600,track-d,/medicaid-income-limits/illinois,illinois,IL,Illinois HFS Income Limits 2026,1,,medium,heavy,screener,qa-state-eligibility,,n,y,CU-077|CU-078,"hfs.illinois.gov,kff",Track D Medicaid factory. Reroute to Track D /medicaid-income-limits/illinois.
MB-0601,track-d,/medicaid-income-limits/indiana,indiana,IN,Indiana HIP/Healthy Indiana Plan Income Limits 2026,1,,medium,heavy,screener,qa-state-eligibility,,n,n,,"in.gov/fssa,kff",Track D Medicaid factory. Reroute to Track D /medicaid-income-limits/indiana. HIP brand variant.
MB-0602,track-d,/medicaid-income-limits/iowa,iowa,IA,Iowa IA Health Link Income Limits 2026,1,,low,heavy,screener,qa-state-eligibility,,n,n,,"hhs.iowa.gov,kff",Track D Medicaid factory. Reroute to Track D /medicaid-income-limits/iowa.
MB-0603,track-d,/medicaid-income-limits/kansas,kansas,KS,Kansas KanCare Income Limits 2026,1,,low,heavy,screener,qa-state-eligibility,,n,n,,"kancare.ks.gov,kff",Track D Medicaid factory. Reroute to Track D /medicaid-income-limits/kansas. KanCare brand variant.
MB-0604,track-d,/medicaid-income-limits/kentucky,kentucky,KY,Kentucky Medicaid Income Limits 2026,1,,medium,heavy,screener,qa-state-eligibility,,n,n,,"chfs.ky.gov,kff",Track D Medicaid factory (SE prioritized). Reroute to Track D /medicaid-income-limits/kentucky.
MB-0605,track-d,/medicaid-income-limits/louisiana,louisiana,LA,Louisiana Healthy Louisiana Income Limits 2026,1,,medium,heavy,screener,qa-state-eligibility,,n,n,,"ldh.la.gov,kff",Track D Medicaid factory (SE prioritized). Reroute to Track D /medicaid-income-limits/louisiana.
MB-0606,track-d,/medicaid-income-limits/maine,maine,ME,Maine MaineCare Income Limits 2026,1,,low,heavy,screener,qa-state-eligibility,,n,n,,"maine.gov/dhhs,kff",Track D Medicaid factory. Reroute to Track D /medicaid-income-limits/maine. MaineCare brand variant.
MB-0607,track-d,/medicaid-income-limits/maryland,maryland,MD,Maryland Medicaid Income Limits 2026,1,,medium,heavy,screener,qa-state-eligibility,,n,n,,"health.maryland.gov,kff",Track D Medicaid factory. Reroute to Track D /medicaid-income-limits/maryland.
MB-0608,track-d,/medicaid-income-limits/massachusetts,massachusetts,MA,Massachusetts MassHealth Income Limits 2026,1,,medium,heavy,screener,qa-state-eligibility,,n,n,,"mass.gov/masshealth,kff",Track D Medicaid factory. Reroute to Track D /medicaid-income-limits/massachusetts. MassHealth brand variant.
MB-0609,track-d,/medicaid-income-limits/michigan,michigan,MI,Michigan Healthy Michigan Income Limits 2026,1,,medium,heavy,screener,qa-state-eligibility,,n,n,,"michigan.gov/mdhhs,kff",Track D Medicaid factory. Reroute to Track D /medicaid-income-limits/michigan.
MB-0610,track-d,/medicaid-income-limits/minnesota,minnesota,MN,Minnesota Medicaid Income Limits 2026,1,,medium,heavy,screener,qa-state-eligibility,,n,n,,"mn.gov/dhs,kff",Track D Medicaid factory. Reroute to Track D /medicaid-income-limits/minnesota.
MB-0611,track-d,/medicaid-income-limits/mississippi,mississippi,MS,Mississippi Medicaid Income Limits 2026,1,,low,heavy,screener,qa-state-eligibility,,n,n,,"medicaid.ms.gov,kff",Track D Medicaid factory (SE prioritized). Reroute to Track D /medicaid-income-limits/mississippi.
MB-0612,track-d,/medicaid-income-limits/missouri,missouri,MO,Missouri MO HealthNet Income Limits 2026,1,,medium,heavy,screener,qa-state-eligibility,,n,n,,"dss.mo.gov,kff",Track D Medicaid factory. Reroute to Track D /medicaid-income-limits/missouri. MO HealthNet brand variant.
MB-0613,track-d,/medicaid-income-limits/montana,montana,MT,Montana Medicaid Income Limits 2026,1,,low,heavy,screener,qa-state-eligibility,,n,n,,"dphhs.mt.gov,kff",Track D Medicaid factory. Reroute to Track D /medicaid-income-limits/montana.
MB-0614,track-d,/medicaid-income-limits/nebraska,nebraska,NE,Nebraska Heritage Health Income Limits 2026,1,,low,heavy,screener,qa-state-eligibility,,n,n,,"dhhs.ne.gov,kff",Track D Medicaid factory. Reroute to Track D /medicaid-income-limits/nebraska.
MB-0615,track-d,/medicaid-income-limits/nevada,nevada,NV,Nevada Medicaid Income Limits 2026,1,,medium,heavy,screener,qa-state-eligibility,,n,y,CU-057|CU-058|CU-060|CU-061,"dhcfp.nv.gov,kff",Track D Medicaid factory. Reroute to Track D /medicaid-income-limits/nevada.
MB-0616,track-d,/medicaid-income-limits/new-hampshire,new-hampshire,NH,New Hampshire Granite Advantage Income Limits 2026,1,,low,heavy,screener,qa-state-eligibility,,n,n,,"dhhs.nh.gov,kff",Track D Medicaid factory. Reroute to Track D /medicaid-income-limits/new-hampshire.
MB-0617,track-d,/medicaid-income-limits/new-jersey,new-jersey,NJ,New Jersey NJ FamilyCare Income Limits 2026,1,,medium,heavy,screener,qa-state-eligibility,,n,y,CU-079|CU-080,"njfamilycare.org,kff",Track D Medicaid factory. Reroute to Track D /medicaid-income-limits/new-jersey. NJ FamilyCare brand variant.
MB-0618,track-d,/medicaid-income-limits/new-mexico,new-mexico,NM,New Mexico Centennial Care Income Limits 2026,1,,low,heavy,screener,qa-state-eligibility,,n,n,,"hsd.state.nm.us,kff",Track D Medicaid factory. Reroute to Track D /medicaid-income-limits/new-mexico.
MB-0619,track-d,/medicaid-income-limits/new-york,new-york,NY,New York Medicaid Income Limits 2026,1,,high,heavy,screener,qa-state-eligibility,,n,y,CU-072|CU-073|CU-075|CU-076,"health.ny.gov,nystateofhealth,kff",Track D Medicaid factory. Reroute to Track D /medicaid-income-limits/new-york.
MB-0620,track-d,/medicaid-income-limits/north-carolina,north-carolina,NC,North Carolina Expanded 2026 Income Limits 2026,1,,medium,heavy,screener,qa-state-eligibility,,n,y,CU-042|CU-043|CU-045|CU-046|CU-111,"medicaid.ncdhhs.gov,kff",Track D Medicaid factory (SE prioritized). Reroute to Track D /medicaid-income-limits/north-carolina. NC expansion is 2026 news angle.
MB-0621,track-d,/medicaid-income-limits/north-dakota,north-dakota,ND,North Dakota Medicaid Income Limits 2026,1,,low,heavy,screener,qa-state-eligibility,,n,n,,"hhs.nd.gov,kff",Track D Medicaid factory. Reroute to Track D /medicaid-income-limits/north-dakota.
MB-0622,track-d,/medicaid-income-limits/ohio,ohio,OH,Ohio Medicaid Income Limits 2026,1,,medium,heavy,screener,qa-state-eligibility,,n,y,CU-062|CU-063|CU-065|CU-066,"medicaid.ohio.gov,kff",Track D Medicaid factory. Reroute to Track D /medicaid-income-limits/ohio.
MB-0623,track-d,/medicaid-income-limits/oklahoma,oklahoma,OK,Oklahoma SoonerCare Income Limits 2026,1,,medium,heavy,screener,qa-state-eligibility,,n,n,,"oklahoma.gov/ohca,kff",Track D Medicaid factory. Reroute to Track D /medicaid-income-limits/oklahoma. SoonerCare brand variant.
MB-0624,track-d,/medicaid-income-limits/oregon,oregon,OR,Oregon OHP Income Limits 2026,1,,medium,heavy,screener,qa-state-eligibility,,n,n,,"oregon.gov/oha,kff",Track D Medicaid factory. Reroute to Track D /medicaid-income-limits/oregon. OHP brand variant.
MB-0625,track-d,/medicaid-income-limits/pennsylvania,pennsylvania,PA,Pennsylvania Medicaid Income Limits 2026,1,,medium,heavy,screener,qa-state-eligibility,,n,y,CU-067|CU-068|CU-070|CU-071,"dhs.pa.gov,kff",Track D Medicaid factory. Reroute to Track D /medicaid-income-limits/pennsylvania.
MB-0626,track-d,/medicaid-income-limits/rhode-island,rhode-island,RI,Rhode Island RIte Care Income Limits 2026,1,,low,heavy,screener,qa-state-eligibility,,n,n,,"eohhs.ri.gov,kff",Track D Medicaid factory. Reroute to Track D /medicaid-income-limits/rhode-island. RIte Care brand variant.
MB-0627,track-d,/medicaid-income-limits/south-carolina,south-carolina,SC,South Carolina Healthy Connections Income Limits 2026,1,,medium,heavy,screener,qa-state-eligibility,,n,n,,"scdhhs.gov,kff",Track D Medicaid factory (SE prioritized). Reroute to Track D /medicaid-income-limits/south-carolina.
MB-0628,track-d,/medicaid-income-limits/south-dakota,south-dakota,SD,South Dakota Expanded 2026 Income Limits 2026,1,,low,heavy,screener,qa-state-eligibility,,n,n,,"dss.sd.gov,kff",Track D Medicaid factory. Reroute to Track D /medicaid-income-limits/south-dakota. SD expansion is 2026 news angle.
MB-0629,track-d,/medicaid-income-limits/tennessee,tennessee,TN,Tennessee TennCare Income Limits 2026,1,,medium,heavy,screener,qa-state-eligibility,,n,n,,"tn.gov/tenncare,kff",Track D Medicaid factory (SE prioritized). Reroute to Track D /medicaid-income-limits/tennessee. TennCare brand variant.
MB-0630,track-d,/medicaid-income-limits/texas,texas,TX,Texas Medicaid Income Limits 2026,1,,high,heavy,screener,qa-state-eligibility,,n,y,CU-027|CU-028|CU-030|CU-031|CU-114,"hhs.texas.gov,kff",Track D Medicaid factory. Reroute to Track D /medicaid-income-limits/texas.
MB-0631,track-d,/medicaid-income-limits/utah,utah,UT,Utah Medicaid Income Limits 2026,1,,medium,heavy,screener,qa-state-eligibility,,n,n,,"medicaid.utah.gov,kff",Track D Medicaid factory. Reroute to Track D /medicaid-income-limits/utah.
MB-0632,track-d,/medicaid-income-limits/vermont,vermont,VT,Vermont Green Mountain Care Income Limits 2026,1,,low,heavy,screener,qa-state-eligibility,,n,n,,"dvha.vermont.gov,kff",Track D Medicaid factory. Reroute to Track D /medicaid-income-limits/vermont.
MB-0633,track-d,/medicaid-income-limits/virginia,virginia,VA,Virginia Cardinal Care Income Limits 2026,1,,medium,heavy,screener,qa-state-eligibility,,n,y,CU-081|CU-082,"dmas.virginia.gov,kff",Track D Medicaid factory (SE prioritized). Reroute to Track D /medicaid-income-limits/virginia. Cardinal Care brand variant.
MB-0634,track-d,/medicaid-income-limits/washington,washington,WA,Washington Apple Health Income Limits 2026,1,,medium,heavy,screener,qa-state-eligibility,,n,y,CU-083|CU-084,"hca.wa.gov,kff",Track D Medicaid factory. Reroute to Track D /medicaid-income-limits/washington. Apple Health brand variant.
MB-0635,track-d,/medicaid-income-limits/west-virginia,west-virginia,WV,West Virginia Medicaid Income Limits 2026,1,,low,heavy,screener,qa-state-eligibility,,n,n,,"dhhr.wv.gov,kff",Track D Medicaid factory (SE prioritized). Reroute to Track D /medicaid-income-limits/west-virginia.
MB-0636,track-d,/medicaid-income-limits/wisconsin,wisconsin,WI,Wisconsin BadgerCare Income Limits 2026,1,,medium,heavy,screener,qa-state-eligibility,,n,n,,"dhs.wisconsin.gov,kff",Track D Medicaid factory. Reroute to Track D /medicaid-income-limits/wisconsin. BadgerCare brand variant.
MB-0637,track-d,/medicaid-income-limits/wyoming,wyoming,WY,Wyoming Medicaid Income Limits 2026,1,,low,heavy,screener,qa-state-eligibility,,n,n,,"health.wyo.gov,kff",Track D Medicaid factory. Reroute to Track D /medicaid-income-limits/wyoming.
MB-0638,persona-x-state,/medicare-advantage/veterans-medicare-advantage-florida,veterans-medicare-advantage-florida,FL,Veterans Medicare Advantage in Florida 2026,1,,low,none,screener,,,n,n,,ma-state-adjacent-templates.csv,MA-state adjacent: persona × state MVP
MB-0639,persona-x-state,/medicare-advantage/veterans-medicare-advantage-georgia,veterans-medicare-advantage-georgia,GA,Veterans Medicare Advantage in Georgia 2026,1,,low,none,screener,,,n,n,,ma-state-adjacent-templates.csv,MA-state adjacent: persona × state MVP
MB-0640,persona-x-state,/medicare-advantage/veterans-medicare-advantage-north-carolina,veterans-medicare-advantage-north-carolina,NC,Veterans Medicare Advantage in North Carolina 2026,1,,low,none,screener,,,n,n,,ma-state-adjacent-templates.csv,MA-state adjacent: persona × state MVP
MB-0641,persona-x-state,/medicare-advantage/dual-eligibles-medicare-advantage-florida,dual-eligibles-medicare-advantage-florida,FL,Dual eligibles Medicare Advantage in Florida 2026,1,,low,none,screener,,,n,n,,ma-state-adjacent-templates.csv,MA-state adjacent: persona × state MVP
MB-0642,persona-x-state,/medicare-advantage/dual-eligibles-medicare-advantage-georgia,dual-eligibles-medicare-advantage-georgia,GA,Dual eligibles Medicare Advantage in Georgia 2026,1,,low,none,screener,,,n,n,,ma-state-adjacent-templates.csv,MA-state adjacent: persona × state MVP
MB-0643,persona-x-state,/medicare-advantage/dual-eligibles-medicare-advantage-north-carolina,dual-eligibles-medicare-advantage-north-carolina,NC,Dual eligibles Medicare Advantage in North Carolina 2026,1,,low,none,screener,,,n,n,,ma-state-adjacent-templates.csv,MA-state adjacent: persona × state MVP
MB-0644,persona-x-state,/medicare-advantage/diabetics-medicare-advantage-florida,diabetics-medicare-advantage-florida,FL,Diabetics Medicare Advantage in Florida 2026,1,,low,none,screener,,,n,n,,ma-state-adjacent-templates.csv,MA-state adjacent: persona × state MVP
MB-0645,persona-x-state,/medicare-advantage/diabetics-medicare-advantage-georgia,diabetics-medicare-advantage-georgia,GA,Diabetics Medicare Advantage in Georgia 2026,1,,low,none,screener,,,n,n,,ma-state-adjacent-templates.csv,MA-state adjacent: persona × state MVP
MB-0646,persona-x-state,/medicare-advantage/diabetics-medicare-advantage-north-carolina,diabetics-medicare-advantage-north-carolina,NC,Diabetics Medicare Advantage in North Carolina 2026,1,,low,none,screener,,,n,n,,ma-state-adjacent-templates.csv,MA-state adjacent: persona × state MVP
MB-0647,persona-x-state,/medicare-advantage/low-income-medicare-advantage-florida,low-income-medicare-advantage-florida,FL,Low income Medicare Advantage in Florida 2026,1,,low,none,screener,,,n,n,,ma-state-adjacent-templates.csv,MA-state adjacent: persona × state MVP
MB-0648,persona-x-state,/medicare-advantage/low-income-medicare-advantage-georgia,low-income-medicare-advantage-georgia,GA,Low income Medicare Advantage in Georgia 2026,1,,low,none,screener,,,n,n,,ma-state-adjacent-templates.csv,MA-state adjacent: persona × state MVP
MB-0649,persona-x-state,/medicare-advantage/low-income-medicare-advantage-north-carolina,low-income-medicare-advantage-north-carolina,NC,Low income Medicare Advantage in North Carolina 2026,1,,low,none,screener,,,n,n,,ma-state-adjacent-templates.csv,MA-state adjacent: persona × state MVP
MB-0650,persona-x-state,/medicare-advantage/spanish-speakers-medicare-advantage-florida,spanish-speakers-medicare-advantage-florida,FL,Spanish-Speaker Medicare Advantage in Florida 2026,1,,low,none,screener,,,n,n,,ma-state-adjacent-templates.csv,MA-state adjacent: persona × state MVP
MB-0651,persona-x-state,/medicare-advantage/spanish-speakers-medicare-advantage-georgia,spanish-speakers-medicare-advantage-georgia,GA,Spanish-Speaker Medicare Advantage in Georgia 2026,1,,low,none,screener,,,n,n,,ma-state-adjacent-templates.csv,MA-state adjacent: persona × state MVP
MB-0652,persona-x-state,/medicare-advantage/spanish-speakers-medicare-advantage-north-carolina,spanish-speakers-medicare-advantage-north-carolina,NC,Spanish-Speaker Medicare Advantage in North Carolina 2026,1,,low,none,screener,,,n,n,,ma-state-adjacent-templates.csv,MA-state adjacent: persona × state MVP
MB-0653,d-snp,/medicare-advantage/dual-eligible-snp-florida,dual-eligible-snp-florida,FL,Dual-Eligible (D-SNP) Medicare Advantage in Florida 2026,1,,low,none,screener,,,n,n,,ma-state-adjacent-templates.csv,MA-state adjacent: D-SNP × top-30 states
MB-0654,d-snp,/medicare-advantage/dual-eligible-snp-georgia,dual-eligible-snp-georgia,GA,Dual-Eligible (D-SNP) Medicare Advantage in Georgia 2026,1,,low,none,screener,,,n,n,,ma-state-adjacent-templates.csv,MA-state adjacent: D-SNP × top-30 states
MB-0655,d-snp,/medicare-advantage/dual-eligible-snp-north-carolina,dual-eligible-snp-north-carolina,NC,Dual-Eligible (D-SNP) Medicare Advantage in North Carolina 2026,1,,low,none,screener,,,n,n,,ma-state-adjacent-templates.csv,MA-state adjacent: D-SNP × top-30 states
MB-0656,d-snp,/medicare-advantage/dual-eligible-snp-virginia,dual-eligible-snp-virginia,VA,Dual-Eligible (D-SNP) Medicare Advantage in Virginia 2026,1,,low,none,screener,,,n,n,,ma-state-adjacent-templates.csv,MA-state adjacent: D-SNP × top-30 states
MB-0657,d-snp,/medicare-advantage/dual-eligible-snp-tennessee,dual-eligible-snp-tennessee,TN,Dual-Eligible (D-SNP) Medicare Advantage in Tennessee 2026,1,,low,none,screener,,,n,n,,ma-state-adjacent-templates.csv,MA-state adjacent: D-SNP × top-30 states
MB-0658,d-snp,/medicare-advantage/dual-eligible-snp-south-carolina,dual-eligible-snp-south-carolina,SC,Dual-Eligible (D-SNP) Medicare Advantage in South Carolina 2026,1,,low,none,screener,,,n,n,,ma-state-adjacent-templates.csv,MA-state adjacent: D-SNP × top-30 states
MB-0659,d-snp,/medicare-advantage/dual-eligible-snp-alabama,dual-eligible-snp-alabama,AL,Dual-Eligible (D-SNP) Medicare Advantage in Alabama 2026,1,,low,none,screener,,,n,n,,ma-state-adjacent-templates.csv,MA-state adjacent: D-SNP × top-30 states
MB-0660,d-snp,/medicare-advantage/dual-eligible-snp-louisiana,dual-eligible-snp-louisiana,LA,Dual-Eligible (D-SNP) Medicare Advantage in Louisiana 2026,1,,low,none,screener,,,n,n,,ma-state-adjacent-templates.csv,MA-state adjacent: D-SNP × top-30 states
MB-0661,d-snp,/medicare-advantage/dual-eligible-snp-kentucky,dual-eligible-snp-kentucky,KY,Dual-Eligible (D-SNP) Medicare Advantage in Kentucky 2026,1,,low,none,screener,,,n,n,,ma-state-adjacent-templates.csv,MA-state adjacent: D-SNP × top-30 states
MB-0662,carrier-x-state,/medicare-advantage/unitedhealthcare-medicare-advantage-florida,unitedhealthcare-medicare-advantage-florida,FL,Unitedhealthcare Medicare Advantage in Florida 2026,1,,medium,none,screener,,,n,n,,ma-state-adjacent-templates.csv,MA-state adjacent: carrier × state trimmed
MB-0663,carrier-x-state,/medicare-advantage/unitedhealthcare-medicare-advantage-georgia,unitedhealthcare-medicare-advantage-georgia,GA,Unitedhealthcare Medicare Advantage in Georgia 2026,1,,medium,none,screener,,,n,n,,ma-state-adjacent-templates.csv,MA-state adjacent: carrier × state trimmed
MB-0664,carrier-x-state,/medicare-advantage/unitedhealthcare-medicare-advantage-north-carolina,unitedhealthcare-medicare-advantage-north-carolina,NC,Unitedhealthcare Medicare Advantage in North Carolina 2026,1,,medium,none,screener,,,n,n,,ma-state-adjacent-templates.csv,MA-state adjacent: carrier × state trimmed
MB-0665,carrier-x-state,/medicare-advantage/unitedhealthcare-medicare-advantage-virginia,unitedhealthcare-medicare-advantage-virginia,VA,Unitedhealthcare Medicare Advantage in Virginia 2026,1,,medium,none,screener,,,n,n,,ma-state-adjacent-templates.csv,MA-state adjacent: carrier × state trimmed
MB-0666,carrier-x-state,/medicare-advantage/humana-medicare-advantage-florida,humana-medicare-advantage-florida,FL,Humana Medicare Advantage in Florida 2026,1,,medium,none,screener,,,n,n,,ma-state-adjacent-templates.csv,MA-state adjacent: carrier × state trimmed
MB-0667,carrier-x-state,/medicare-advantage/humana-medicare-advantage-georgia,humana-medicare-advantage-georgia,GA,Humana Medicare Advantage in Georgia 2026,1,,medium,none,screener,,,n,n,,ma-state-adjacent-templates.csv,MA-state adjacent: carrier × state trimmed
