row_id,template,route,topic_slug,state,title,priority,demand_score,competitor_density,busa_overlap,cta_target,subtype,topic_type,already_live,migrated_from_sheet,sheet_row_id,sources,notes
MB-1183,persona-x-state,/for/doordash-uber-drivers-rhode-island,doordash-uber-drivers-rhode-island,RI,Rhode Island Health Insurance for DoorDash and Uber Drivers : 1099 + State Stipend Options 2026,2,,low,slight,screener,,,n,n,,"bing-related(driver-coverage-signal-deflated-per-critique),competitor-landscape-§6(uber-california-callout),CONTENT_INVENTORY-CU-156,B(Stride+DasherCentral+SoloCovered+UnitedNational),GigWorker-Reddit-r-doordash",Persona × state fork from doordash-uber-drivers
MB-1184,persona-x-state,/for/doordash-uber-drivers-south-dakota,doordash-uber-drivers-south-dakota,SD,South Dakota Health Insurance for DoorDash and Uber Drivers : 1099 + State Stipend Options 2026,2,,low,slight,screener,,,n,n,,"bing-related(driver-coverage-signal-deflated-per-critique),competitor-landscape-§6(uber-california-callout),CONTENT_INVENTORY-CU-156,B(Stride+DasherCentral+SoloCovered+UnitedNational),GigWorker-Reddit-r-doordash",Persona × state fork from doordash-uber-drivers
MB-1185,persona-x-state,/for/doordash-uber-drivers-texas,doordash-uber-drivers-texas,TX,Texas Health Insurance for DoorDash and Uber Drivers : 1099 + State Stipend Options 2026,2,,low,slight,screener,,,n,n,,"bing-related(driver-coverage-signal-deflated-per-critique),competitor-landscape-§6(uber-california-callout),CONTENT_INVENTORY-CU-156,B(Stride+DasherCentral+SoloCovered+UnitedNational),GigWorker-Reddit-r-doordash",Persona × state fork from doordash-uber-drivers
MB-1186,persona-x-state,/for/doordash-uber-drivers-utah,doordash-uber-drivers-utah,UT,Utah Health Insurance for DoorDash and Uber Drivers : 1099 + State Stipend Options 2026,2,,low,slight,screener,,,n,n,,"bing-related(driver-coverage-signal-deflated-per-critique),competitor-landscape-§6(uber-california-callout),CONTENT_INVENTORY-CU-156,B(Stride+DasherCentral+SoloCovered+UnitedNational),GigWorker-Reddit-r-doordash",Persona × state fork from doordash-uber-drivers
MB-1187,persona-x-state,/for/doordash-uber-drivers-vermont,doordash-uber-drivers-vermont,VT,Vermont Health Insurance for DoorDash and Uber Drivers : 1099 + State Stipend Options 2026,2,,low,slight,screener,,,n,n,,"bing-related(driver-coverage-signal-deflated-per-critique),competitor-landscape-§6(uber-california-callout),CONTENT_INVENTORY-CU-156,B(Stride+DasherCentral+SoloCovered+UnitedNational),GigWorker-Reddit-r-doordash",Persona × state fork from doordash-uber-drivers
MB-1188,persona-x-state,/for/doordash-uber-drivers-washington,doordash-uber-drivers-washington,WA,Washington Health Insurance for DoorDash and Uber Drivers : 1099 + State Stipend Options 2026,2,,low,slight,screener,,,n,n,,"bing-related(driver-coverage-signal-deflated-per-critique),competitor-landscape-§6(uber-california-callout),CONTENT_INVENTORY-CU-156,B(Stride+DasherCentral+SoloCovered+UnitedNational),GigWorker-Reddit-r-doordash",Persona × state fork from doordash-uber-drivers
MB-1189,persona-x-state,/for/doordash-uber-drivers-wisconsin,doordash-uber-drivers-wisconsin,WI,Wisconsin Health Insurance for DoorDash and Uber Drivers : 1099 + State Stipend Options 2026,2,,low,slight,screener,,,n,n,,"bing-related(driver-coverage-signal-deflated-per-critique),competitor-landscape-§6(uber-california-callout),CONTENT_INVENTORY-CU-156,B(Stride+DasherCentral+SoloCovered+UnitedNational),GigWorker-Reddit-r-doordash",Persona × state fork from doordash-uber-drivers
MB-1190,persona-x-state,/for/doordash-uber-drivers-wyoming,doordash-uber-drivers-wyoming,WY,Wyoming Health Insurance for DoorDash and Uber Drivers : 1099 + State Stipend Options 2026,2,,low,slight,screener,,,n,n,,"bing-related(driver-coverage-signal-deflated-per-critique),competitor-landscape-§6(uber-california-callout),CONTENT_INVENTORY-CU-156,B(Stride+DasherCentral+SoloCovered+UnitedNational),GigWorker-Reddit-r-doordash",Persona × state fork from doordash-uber-drivers
MB-1191,persona-x-state,/for/realtors-alaska,realtors-alaska,AK,Alaska Health Insurance for Real Estate Agents and Realtors : 1099 Broker Guide 2026,2,,low,slight,screener,,,n,n,,"NAR-Membership-Stats,Realtor.com-Membership,1099-overlap,critique-§4.3-promote-to-P2,B(RKAInsurance+HSAforAmerica+NARRPVB)",Persona × state fork from realtors
MB-1192,persona-x-state,/for/realtors-arizona,realtors-arizona,AZ,Arizona Health Insurance for Real Estate Agents and Realtors : 1099 Broker Guide 2026,2,,low,slight,screener,,,n,n,,"NAR-Membership-Stats,Realtor.com-Membership,1099-overlap,critique-§4.3-promote-to-P2,B(RKAInsurance+HSAforAmerica+NARRPVB)",Persona × state fork from realtors
MB-1193,persona-x-state,/for/realtors-california,realtors-california,CA,California Health Insurance for Real Estate Agents and Realtors : 1099 Broker Guide 2026,2,,low,slight,screener,,,n,n,,"NAR-Membership-Stats,Realtor.com-Membership,1099-overlap,critique-§4.3-promote-to-P2,B(RKAInsurance+HSAforAmerica+NARRPVB)",Persona × state fork from realtors
MB-1194,persona-x-state,/for/realtors-colorado,realtors-colorado,CO,Colorado Health Insurance for Real Estate Agents and Realtors : 1099 Broker Guide 2026,2,,low,slight,screener,,,n,n,,"NAR-Membership-Stats,Realtor.com-Membership,1099-overlap,critique-§4.3-promote-to-P2,B(RKAInsurance+HSAforAmerica+NARRPVB)",Persona × state fork from realtors
MB-1195,persona-x-state,/for/realtors-connecticut,realtors-connecticut,CT,Connecticut Health Insurance for Real Estate Agents and Realtors : 1099 Broker Guide 2026,2,,low,slight,screener,,,n,n,,"NAR-Membership-Stats,Realtor.com-Membership,1099-overlap,critique-§4.3-promote-to-P2,B(RKAInsurance+HSAforAmerica+NARRPVB)",Persona × state fork from realtors
MB-1196,persona-x-state,/for/realtors-delaware,realtors-delaware,DE,Delaware Health Insurance for Real Estate Agents and Realtors : 1099 Broker Guide 2026,2,,low,slight,screener,,,n,n,,"NAR-Membership-Stats,Realtor.com-Membership,1099-overlap,critique-§4.3-promote-to-P2,B(RKAInsurance+HSAforAmerica+NARRPVB)",Persona × state fork from realtors
MB-1197,persona-x-state,/for/realtors-dc,realtors-dc,DC,Washington DC Health Insurance for Real Estate Agents and Realtors : 1099 Broker Guide 2026,2,,low,slight,screener,,,n,n,,"NAR-Membership-Stats,Realtor.com-Membership,1099-overlap,critique-§4.3-promote-to-P2,B(RKAInsurance+HSAforAmerica+NARRPVB)",Persona × state fork from realtors
MB-1198,persona-x-state,/for/realtors-hawaii,realtors-hawaii,HI,Hawaii Health Insurance for Real Estate Agents and Realtors : 1099 Broker Guide 2026,2,,low,slight,screener,,,n,n,,"NAR-Membership-Stats,Realtor.com-Membership,1099-overlap,critique-§4.3-promote-to-P2,B(RKAInsurance+HSAforAmerica+NARRPVB)",Persona × state fork from realtors
MB-1199,persona-x-state,/for/realtors-idaho,realtors-idaho,ID,Idaho Health Insurance for Real Estate Agents and Realtors : 1099 Broker Guide 2026,2,,low,slight,screener,,,n,n,,"NAR-Membership-Stats,Realtor.com-Membership,1099-overlap,critique-§4.3-promote-to-P2,B(RKAInsurance+HSAforAmerica+NARRPVB)",Persona × state fork from realtors
MB-1200,persona-x-state,/for/realtors-illinois,realtors-illinois,IL,Illinois Health Insurance for Real Estate Agents and Realtors : 1099 Broker Guide 2026,2,,low,slight,screener,,,n,n,,"NAR-Membership-Stats,Realtor.com-Membership,1099-overlap,critique-§4.3-promote-to-P2,B(RKAInsurance+HSAforAmerica+NARRPVB)",Persona × state fork from realtors
MB-1201,persona-x-state,/for/realtors-indiana,realtors-indiana,IN,Indiana Health Insurance for Real Estate Agents and Realtors : 1099 Broker Guide 2026,2,,low,slight,screener,,,n,n,,"NAR-Membership-Stats,Realtor.com-Membership,1099-overlap,critique-§4.3-promote-to-P2,B(RKAInsurance+HSAforAmerica+NARRPVB)",Persona × state fork from realtors
MB-1202,persona-x-state,/for/realtors-iowa,realtors-iowa,IA,Iowa Health Insurance for Real Estate Agents and Realtors : 1099 Broker Guide 2026,2,,low,slight,screener,,,n,n,,"NAR-Membership-Stats,Realtor.com-Membership,1099-overlap,critique-§4.3-promote-to-P2,B(RKAInsurance+HSAforAmerica+NARRPVB)",Persona × state fork from realtors
MB-1203,persona-x-state,/for/realtors-kansas,realtors-kansas,KS,Kansas Health Insurance for Real Estate Agents and Realtors : 1099 Broker Guide 2026,2,,low,slight,screener,,,n,n,,"NAR-Membership-Stats,Realtor.com-Membership,1099-overlap,critique-§4.3-promote-to-P2,B(RKAInsurance+HSAforAmerica+NARRPVB)",Persona × state fork from realtors
MB-1204,persona-x-state,/for/realtors-maine,realtors-maine,ME,Maine Health Insurance for Real Estate Agents and Realtors : 1099 Broker Guide 2026,2,,low,slight,screener,,,n,n,,"NAR-Membership-Stats,Realtor.com-Membership,1099-overlap,critique-§4.3-promote-to-P2,B(RKAInsurance+HSAforAmerica+NARRPVB)",Persona × state fork from realtors
MB-1205,persona-x-state,/for/realtors-maryland,realtors-maryland,MD,Maryland Health Insurance for Real Estate Agents and Realtors : 1099 Broker Guide 2026,2,,low,slight,screener,,,n,n,,"NAR-Membership-Stats,Realtor.com-Membership,1099-overlap,critique-§4.3-promote-to-P2,B(RKAInsurance+HSAforAmerica+NARRPVB)",Persona × state fork from realtors
MB-1206,persona-x-state,/for/realtors-massachusetts,realtors-massachusetts,MA,Massachusetts Health Insurance for Real Estate Agents and Realtors : 1099 Broker Guide 2026,2,,low,slight,screener,,,n,n,,"NAR-Membership-Stats,Realtor.com-Membership,1099-overlap,critique-§4.3-promote-to-P2,B(RKAInsurance+HSAforAmerica+NARRPVB)",Persona × state fork from realtors
MB-1207,persona-x-state,/for/realtors-michigan,realtors-michigan,MI,Michigan Health Insurance for Real Estate Agents and Realtors : 1099 Broker Guide 2026,2,,low,slight,screener,,,n,n,,"NAR-Membership-Stats,Realtor.com-Membership,1099-overlap,critique-§4.3-promote-to-P2,B(RKAInsurance+HSAforAmerica+NARRPVB)",Persona × state fork from realtors
MB-1208,persona-x-state,/for/realtors-minnesota,realtors-minnesota,MN,Minnesota Health Insurance for Real Estate Agents and Realtors : 1099 Broker Guide 2026,2,,low,slight,screener,,,n,n,,"NAR-Membership-Stats,Realtor.com-Membership,1099-overlap,critique-§4.3-promote-to-P2,B(RKAInsurance+HSAforAmerica+NARRPVB)",Persona × state fork from realtors
MB-1209,persona-x-state,/for/realtors-missouri,realtors-missouri,MO,Missouri Health Insurance for Real Estate Agents and Realtors : 1099 Broker Guide 2026,2,,low,slight,screener,,,n,n,,"NAR-Membership-Stats,Realtor.com-Membership,1099-overlap,critique-§4.3-promote-to-P2,B(RKAInsurance+HSAforAmerica+NARRPVB)",Persona × state fork from realtors
MB-1210,persona-x-state,/for/realtors-montana,realtors-montana,MT,Montana Health Insurance for Real Estate Agents and Realtors : 1099 Broker Guide 2026,2,,low,slight,screener,,,n,n,,"NAR-Membership-Stats,Realtor.com-Membership,1099-overlap,critique-§4.3-promote-to-P2,B(RKAInsurance+HSAforAmerica+NARRPVB)",Persona × state fork from realtors
MB-1211,persona-x-state,/for/realtors-nebraska,realtors-nebraska,NE,Nebraska Health Insurance for Real Estate Agents and Realtors : 1099 Broker Guide 2026,2,,low,slight,screener,,,n,n,,"NAR-Membership-Stats,Realtor.com-Membership,1099-overlap,critique-§4.3-promote-to-P2,B(RKAInsurance+HSAforAmerica+NARRPVB)",Persona × state fork from realtors
MB-1212,persona-x-state,/for/realtors-nevada,realtors-nevada,NV,Nevada Health Insurance for Real Estate Agents and Realtors : 1099 Broker Guide 2026,2,,low,slight,screener,,,n,n,,"NAR-Membership-Stats,Realtor.com-Membership,1099-overlap,critique-§4.3-promote-to-P2,B(RKAInsurance+HSAforAmerica+NARRPVB)",Persona × state fork from realtors
MB-1213,persona-x-state,/for/realtors-new-hampshire,realtors-new-hampshire,NH,New Hampshire Health Insurance for Real Estate Agents and Realtors : 1099 Broker Guide 2026,2,,low,slight,screener,,,n,n,,"NAR-Membership-Stats,Realtor.com-Membership,1099-overlap,critique-§4.3-promote-to-P2,B(RKAInsurance+HSAforAmerica+NARRPVB)",Persona × state fork from realtors
MB-1214,persona-x-state,/for/realtors-new-jersey,realtors-new-jersey,NJ,New Jersey Health Insurance for Real Estate Agents and Realtors : 1099 Broker Guide 2026,2,,low,slight,screener,,,n,n,,"NAR-Membership-Stats,Realtor.com-Membership,1099-overlap,critique-§4.3-promote-to-P2,B(RKAInsurance+HSAforAmerica+NARRPVB)",Persona × state fork from realtors
MB-1215,persona-x-state,/for/realtors-new-mexico,realtors-new-mexico,NM,New Mexico Health Insurance for Real Estate Agents and Realtors : 1099 Broker Guide 2026,2,,low,slight,screener,,,n,n,,"NAR-Membership-Stats,Realtor.com-Membership,1099-overlap,critique-§4.3-promote-to-P2,B(RKAInsurance+HSAforAmerica+NARRPVB)",Persona × state fork from realtors
MB-1216,persona-x-state,/for/realtors-new-york,realtors-new-york,NY,New York Health Insurance for Real Estate Agents and Realtors : 1099 Broker Guide 2026,2,,low,slight,screener,,,n,n,,"NAR-Membership-Stats,Realtor.com-Membership,1099-overlap,critique-§4.3-promote-to-P2,B(RKAInsurance+HSAforAmerica+NARRPVB)",Persona × state fork from realtors
MB-1217,persona-x-state,/for/realtors-north-dakota,realtors-north-dakota,ND,North Dakota Health Insurance for Real Estate Agents and Realtors : 1099 Broker Guide 2026,2,,low,slight,screener,,,n,n,,"NAR-Membership-Stats,Realtor.com-Membership,1099-overlap,critique-§4.3-promote-to-P2,B(RKAInsurance+HSAforAmerica+NARRPVB)",Persona × state fork from realtors
MB-1218,persona-x-state,/for/realtors-ohio,realtors-ohio,OH,Ohio Health Insurance for Real Estate Agents and Realtors : 1099 Broker Guide 2026,2,,low,slight,screener,,,n,n,,"NAR-Membership-Stats,Realtor.com-Membership,1099-overlap,critique-§4.3-promote-to-P2,B(RKAInsurance+HSAforAmerica+NARRPVB)",Persona × state fork from realtors
MB-1219,persona-x-state,/for/realtors-oklahoma,realtors-oklahoma,OK,Oklahoma Health Insurance for Real Estate Agents and Realtors : 1099 Broker Guide 2026,2,,low,slight,screener,,,n,n,,"NAR-Membership-Stats,Realtor.com-Membership,1099-overlap,critique-§4.3-promote-to-P2,B(RKAInsurance+HSAforAmerica+NARRPVB)",Persona × state fork from realtors
MB-1220,persona-x-state,/for/realtors-oregon,realtors-oregon,OR,Oregon Health Insurance for Real Estate Agents and Realtors : 1099 Broker Guide 2026,2,,low,slight,screener,,,n,n,,"NAR-Membership-Stats,Realtor.com-Membership,1099-overlap,critique-§4.3-promote-to-P2,B(RKAInsurance+HSAforAmerica+NARRPVB)",Persona × state fork from realtors
MB-1221,persona-x-state,/for/realtors-pennsylvania,realtors-pennsylvania,PA,Pennsylvania Health Insurance for Real Estate Agents and Realtors : 1099 Broker Guide 2026,2,,low,slight,screener,,,n,n,,"NAR-Membership-Stats,Realtor.com-Membership,1099-overlap,critique-§4.3-promote-to-P2,B(RKAInsurance+HSAforAmerica+NARRPVB)",Persona × state fork from realtors
MB-1222,persona-x-state,/for/realtors-rhode-island,realtors-rhode-island,RI,Rhode Island Health Insurance for Real Estate Agents and Realtors : 1099 Broker Guide 2026,2,,low,slight,screener,,,n,n,,"NAR-Membership-Stats,Realtor.com-Membership,1099-overlap,critique-§4.3-promote-to-P2,B(RKAInsurance+HSAforAmerica+NARRPVB)",Persona × state fork from realtors
MB-1223,persona-x-state,/for/realtors-south-dakota,realtors-south-dakota,SD,South Dakota Health Insurance for Real Estate Agents and Realtors : 1099 Broker Guide 2026,2,,low,slight,screener,,,n,n,,"NAR-Membership-Stats,Realtor.com-Membership,1099-overlap,critique-§4.3-promote-to-P2,B(RKAInsurance+HSAforAmerica+NARRPVB)",Persona × state fork from realtors
MB-1224,persona-x-state,/for/realtors-texas,realtors-texas,TX,Texas Health Insurance for Real Estate Agents and Realtors : 1099 Broker Guide 2026,2,,low,slight,screener,,,n,n,,"NAR-Membership-Stats,Realtor.com-Membership,1099-overlap,critique-§4.3-promote-to-P2,B(RKAInsurance+HSAforAmerica+NARRPVB)",Persona × state fork from realtors
MB-1225,persona-x-state,/for/realtors-utah,realtors-utah,UT,Utah Health Insurance for Real Estate Agents and Realtors : 1099 Broker Guide 2026,2,,low,slight,screener,,,n,n,,"NAR-Membership-Stats,Realtor.com-Membership,1099-overlap,critique-§4.3-promote-to-P2,B(RKAInsurance+HSAforAmerica+NARRPVB)",Persona × state fork from realtors
MB-1226,persona-x-state,/for/realtors-vermont,realtors-vermont,VT,Vermont Health Insurance for Real Estate Agents and Realtors : 1099 Broker Guide 2026,2,,low,slight,screener,,,n,n,,"NAR-Membership-Stats,Realtor.com-Membership,1099-overlap,critique-§4.3-promote-to-P2,B(RKAInsurance+HSAforAmerica+NARRPVB)",Persona × state fork from realtors
MB-1227,persona-x-state,/for/realtors-washington,realtors-washington,WA,Washington Health Insurance for Real Estate Agents and Realtors : 1099 Broker Guide 2026,2,,low,slight,screener,,,n,n,,"NAR-Membership-Stats,Realtor.com-Membership,1099-overlap,critique-§4.3-promote-to-P2,B(RKAInsurance+HSAforAmerica+NARRPVB)",Persona × state fork from realtors
MB-1228,persona-x-state,/for/realtors-wisconsin,realtors-wisconsin,WI,Wisconsin Health Insurance for Real Estate Agents and Realtors : 1099 Broker Guide 2026,2,,low,slight,screener,,,n,n,,"NAR-Membership-Stats,Realtor.com-Membership,1099-overlap,critique-§4.3-promote-to-P2,B(RKAInsurance+HSAforAmerica+NARRPVB)",Persona × state fork from realtors
MB-1229,persona-x-state,/for/realtors-wyoming,realtors-wyoming,WY,Wyoming Health Insurance for Real Estate Agents and Realtors : 1099 Broker Guide 2026,2,,low,slight,screener,,,n,n,,"NAR-Membership-Stats,Realtor.com-Membership,1099-overlap,critique-§4.3-promote-to-P2,B(RKAInsurance+HSAforAmerica+NARRPVB)",Persona × state fork from realtors
MB-1230,persona-x-state,/for/truckers-alaska,truckers-alaska,AK,Alaska Health Insurance for Independent Truckers : Owner-Operator + DOT Physical 2026,2,,low,slight,screener,,,n,n,,"bing-related(245)(sap-program-truck-drivers),BLS-OES-53-3032,critique-§4.3-promote-to-P2,B(TruckersHealthcare+TruckersNetwork+Stride)",Persona × state fork from truckers
MB-1231,persona-x-state,/for/truckers-arizona,truckers-arizona,AZ,Arizona Health Insurance for Independent Truckers : Owner-Operator + DOT Physical 2026,2,,low,slight,screener,,,n,n,,"bing-related(245)(sap-program-truck-drivers),BLS-OES-53-3032,critique-§4.3-promote-to-P2,B(TruckersHealthcare+TruckersNetwork+Stride)",Persona × state fork from truckers
MB-1232,persona-x-state,/for/truckers-california,truckers-california,CA,California Health Insurance for Independent Truckers : Owner-Operator + DOT Physical 2026,2,,low,slight,screener,,,n,n,,"bing-related(245)(sap-program-truck-drivers),BLS-OES-53-3032,critique-§4.3-promote-to-P2,B(TruckersHealthcare+TruckersNetwork+Stride)",Persona × state fork from truckers
MB-1233,persona-x-state,/for/truckers-colorado,truckers-colorado,CO,Colorado Health Insurance for Independent Truckers : Owner-Operator + DOT Physical 2026,2,,low,slight,screener,,,n,n,,"bing-related(245)(sap-program-truck-drivers),BLS-OES-53-3032,critique-§4.3-promote-to-P2,B(TruckersHealthcare+TruckersNetwork+Stride)",Persona × state fork from truckers
MB-1234,persona-x-state,/for/truckers-connecticut,truckers-connecticut,CT,Connecticut Health Insurance for Independent Truckers : Owner-Operator + DOT Physical 2026,2,,low,slight,screener,,,n,n,,"bing-related(245)(sap-program-truck-drivers),BLS-OES-53-3032,critique-§4.3-promote-to-P2,B(TruckersHealthcare+TruckersNetwork+Stride)",Persona × state fork from truckers
MB-1235,persona-x-state,/for/truckers-delaware,truckers-delaware,DE,Delaware Health Insurance for Independent Truckers : Owner-Operator + DOT Physical 2026,2,,low,slight,screener,,,n,n,,"bing-related(245)(sap-program-truck-drivers),BLS-OES-53-3032,critique-§4.3-promote-to-P2,B(TruckersHealthcare+TruckersNetwork+Stride)",Persona × state fork from truckers
MB-1236,persona-x-state,/for/truckers-dc,truckers-dc,DC,Washington DC Health Insurance for Independent Truckers : Owner-Operator + DOT Physical 2026,2,,low,slight,screener,,,n,n,,"bing-related(245)(sap-program-truck-drivers),BLS-OES-53-3032,critique-§4.3-promote-to-P2,B(TruckersHealthcare+TruckersNetwork+Stride)",Persona × state fork from truckers
MB-1237,persona-x-state,/for/truckers-hawaii,truckers-hawaii,HI,Hawaii Health Insurance for Independent Truckers : Owner-Operator + DOT Physical 2026,2,,low,slight,screener,,,n,n,,"bing-related(245)(sap-program-truck-drivers),BLS-OES-53-3032,critique-§4.3-promote-to-P2,B(TruckersHealthcare+TruckersNetwork+Stride)",Persona × state fork from truckers
MB-1238,persona-x-state,/for/truckers-idaho,truckers-idaho,ID,Idaho Health Insurance for Independent Truckers : Owner-Operator + DOT Physical 2026,2,,low,slight,screener,,,n,n,,"bing-related(245)(sap-program-truck-drivers),BLS-OES-53-3032,critique-§4.3-promote-to-P2,B(TruckersHealthcare+TruckersNetwork+Stride)",Persona × state fork from truckers
MB-1239,persona-x-state,/for/truckers-illinois,truckers-illinois,IL,Illinois Health Insurance for Independent Truckers : Owner-Operator + DOT Physical 2026,2,,low,slight,screener,,,n,n,,"bing-related(245)(sap-program-truck-drivers),BLS-OES-53-3032,critique-§4.3-promote-to-P2,B(TruckersHealthcare+TruckersNetwork+Stride)",Persona × state fork from truckers
MB-1240,persona-x-state,/for/truckers-indiana,truckers-indiana,IN,Indiana Health Insurance for Independent Truckers : Owner-Operator + DOT Physical 2026,2,,low,slight,screener,,,n,n,,"bing-related(245)(sap-program-truck-drivers),BLS-OES-53-3032,critique-§4.3-promote-to-P2,B(TruckersHealthcare+TruckersNetwork+Stride)",Persona × state fork from truckers
MB-1241,persona-x-state,/for/truckers-iowa,truckers-iowa,IA,Iowa Health Insurance for Independent Truckers : Owner-Operator + DOT Physical 2026,2,,low,slight,screener,,,n,n,,"bing-related(245)(sap-program-truck-drivers),BLS-OES-53-3032,critique-§4.3-promote-to-P2,B(TruckersHealthcare+TruckersNetwork+Stride)",Persona × state fork from truckers
MB-1242,persona-x-state,/for/truckers-kansas,truckers-kansas,KS,Kansas Health Insurance for Independent Truckers : Owner-Operator + DOT Physical 2026,2,,low,slight,screener,,,n,n,,"bing-related(245)(sap-program-truck-drivers),BLS-OES-53-3032,critique-§4.3-promote-to-P2,B(TruckersHealthcare+TruckersNetwork+Stride)",Persona × state fork from truckers
MB-1243,persona-x-state,/for/truckers-maine,truckers-maine,ME,Maine Health Insurance for Independent Truckers : Owner-Operator + DOT Physical 2026,2,,low,slight,screener,,,n,n,,"bing-related(245)(sap-program-truck-drivers),BLS-OES-53-3032,critique-§4.3-promote-to-P2,B(TruckersHealthcare+TruckersNetwork+Stride)",Persona × state fork from truckers
MB-1244,persona-x-state,/for/truckers-maryland,truckers-maryland,MD,Maryland Health Insurance for Independent Truckers : Owner-Operator + DOT Physical 2026,2,,low,slight,screener,,,n,n,,"bing-related(245)(sap-program-truck-drivers),BLS-OES-53-3032,critique-§4.3-promote-to-P2,B(TruckersHealthcare+TruckersNetwork+Stride)",Persona × state fork from truckers
MB-1245,persona-x-state,/for/truckers-massachusetts,truckers-massachusetts,MA,Massachusetts Health Insurance for Independent Truckers : Owner-Operator + DOT Physical 2026,2,,low,slight,screener,,,n,n,,"bing-related(245)(sap-program-truck-drivers),BLS-OES-53-3032,critique-§4.3-promote-to-P2,B(TruckersHealthcare+TruckersNetwork+Stride)",Persona × state fork from truckers
MB-1246,persona-x-state,/for/truckers-michigan,truckers-michigan,MI,Michigan Health Insurance for Independent Truckers : Owner-Operator + DOT Physical 2026,2,,low,slight,screener,,,n,n,,"bing-related(245)(sap-program-truck-drivers),BLS-OES-53-3032,critique-§4.3-promote-to-P2,B(TruckersHealthcare+TruckersNetwork+Stride)",Persona × state fork from truckers
MB-1247,persona-x-state,/for/truckers-minnesota,truckers-minnesota,MN,Minnesota Health Insurance for Independent Truckers : Owner-Operator + DOT Physical 2026,2,,low,slight,screener,,,n,n,,"bing-related(245)(sap-program-truck-drivers),BLS-OES-53-3032,critique-§4.3-promote-to-P2,B(TruckersHealthcare+TruckersNetwork+Stride)",Persona × state fork from truckers
MB-1248,persona-x-state,/for/truckers-missouri,truckers-missouri,MO,Missouri Health Insurance for Independent Truckers : Owner-Operator + DOT Physical 2026,2,,low,slight,screener,,,n,n,,"bing-related(245)(sap-program-truck-drivers),BLS-OES-53-3032,critique-§4.3-promote-to-P2,B(TruckersHealthcare+TruckersNetwork+Stride)",Persona × state fork from truckers
MB-1249,persona-x-state,/for/truckers-montana,truckers-montana,MT,Montana Health Insurance for Independent Truckers : Owner-Operator + DOT Physical 2026,2,,low,slight,screener,,,n,n,,"bing-related(245)(sap-program-truck-drivers),BLS-OES-53-3032,critique-§4.3-promote-to-P2,B(TruckersHealthcare+TruckersNetwork+Stride)",Persona × state fork from truckers
MB-1250,persona-x-state,/for/truckers-nebraska,truckers-nebraska,NE,Nebraska Health Insurance for Independent Truckers : Owner-Operator + DOT Physical 2026,2,,low,slight,screener,,,n,n,,"bing-related(245)(sap-program-truck-drivers),BLS-OES-53-3032,critique-§4.3-promote-to-P2,B(TruckersHealthcare+TruckersNetwork+Stride)",Persona × state fork from truckers
MB-1251,persona-x-state,/for/truckers-nevada,truckers-nevada,NV,Nevada Health Insurance for Independent Truckers : Owner-Operator + DOT Physical 2026,2,,low,slight,screener,,,n,n,,"bing-related(245)(sap-program-truck-drivers),BLS-OES-53-3032,critique-§4.3-promote-to-P2,B(TruckersHealthcare+TruckersNetwork+Stride)",Persona × state fork from truckers
MB-1252,persona-x-state,/for/truckers-new-hampshire,truckers-new-hampshire,NH,New Hampshire Health Insurance for Independent Truckers : Owner-Operator + DOT Physical 2026,2,,low,slight,screener,,,n,n,,"bing-related(245)(sap-program-truck-drivers),BLS-OES-53-3032,critique-§4.3-promote-to-P2,B(TruckersHealthcare+TruckersNetwork+Stride)",Persona × state fork from truckers
