row_id,template,route,topic_slug,state,title,priority,demand_score,competitor_density,busa_overlap,cta_target,subtype,topic_type,already_live,migrated_from_sheet,sheet_row_id,sources,notes
MB-0001,procedure,/cost/cataract-surgery,cataract-surgery,,Cataract Surgery Cost Without Insurance in 2026 (CPT 66984),1,12730,high,none,analyzer,,,n,n,,"bing-stats,bing-related(6),clincalc,goodrx,kff,obvious-50",already_queued
MB-0002,ma-state,/medicare-advantage/georgia,georgia,GA,Medicare Advantage Plans in Georgia 2026,1,9200,high,none,screener,,,n,n,,"CMS-State-County-Penetration-May2026,KFF-MA-2025-enrollment,KFF-2026-Spotlight,NerdWallet-GA,MedicareGuide-GA,US-News-GA,eHealth-GA","Top Tier 1 — large MA shopper pool, Kaiser-GA defensible answer; partial Spanish opportunity in Atlanta metro"
MB-0003,ma-state,/medicare-advantage/north-carolina,north-carolina,NC,Medicare Advantage Plans in North Carolina 2026,1,9100,high,none,screener,,,n,n,,"CMS-State-County-Penetration-May2026,KFF-MA-2025-enrollment,KFF-2026-Spotlight,NerdWallet-NC,MedicareGuide-NC,US-News-NC,eHealth-NC",Largest total Medicare enrollment among unshipped states
MB-0004,ma-state,/medicare-advantage/arizona,arizona,AZ,Medicare Advantage Plans in Arizona 2026,1,8800,high,none,screener,,,n,n,,"CMS-State-County-Penetration-May2026,KFF-MA-2025-enrollment,KFF-2026-Spotlight,NerdWallet-AZ,MedicareGuide-AZ,US-News-AZ,eHealth-AZ",High Latino population — strong Spanish twin double-count via AI-citation surface
MB-0005,ma-state,/medicare-advantage/tennessee,tennessee,TN,Medicare Advantage Plans in Tennessee 2026,1,8100,high,none,screener,,,n,n,,"CMS-State-County-Penetration-May2026,KFF-MA-2025-enrollment,KFF-2026-Spotlight,NerdWallet-TN,MedicareGuide-TN,US-News-TN,eHealth-TN",Highest penetration in Tier 1 (59%); TennCare state brand
MB-0006,ma-state,/medicare-advantage/new-jersey,new-jersey,NJ,Medicare Advantage Plans in New Jersey 2026,1,8000,high,none,screener,,,n,n,,"CMS-State-County-Penetration-May2026,KFF-MA-2025-enrollment,KFF-2026-Spotlight,NerdWallet-NJ,MedicareGuide-NJ,US-News-NJ,eHealth-NJ",Largest unshipped Northeast; Spanish opportunity
MB-0007,ma-state,/medicare-advantage/illinois,illinois,IL,Medicare Advantage Plans in Illinois 2026,1,7900,high,none,screener,,,n,n,,"CMS-State-County-Penetration-May2026,KFF-MA-2025-enrollment,KFF-2026-Spotlight,NerdWallet-IL,MedicareGuide-IL,US-News-IL,eHealth-IL","Penetration adjudicated to 50% (A had stale 41%, B had 55%); strong Chicago Spanish twin opportunity"
MB-0008,ma-state,/medicare-advantage/virginia,virginia,VA,Medicare Advantage Plans in Virginia 2026,1,7300,high,none,screener,,,n,n,,"CMS-State-County-Penetration-May2026,KFF-MA-2025-enrollment,KFF-2026-Spotlight,NerdWallet-VA,MedicareGuide-VA,US-News-VA,eHealth-VA",DC-metro adjacency; penetration adjudicated to 49% (B)
MB-0009,glossary,/glossary/hmo-vs-ppo,hmo-vs-ppo,,HMO vs PPO: 2026 Plan Type Differences Explained,1,7242,high,none,screener,,comparison-2hop,n,n,,bing-GetKeyword-broad-13wk,Highest 2-hop volume in glossary; CRITICAL write
MB-0010,ma-state,/medicare-advantage/massachusetts,massachusetts,MA,Medicare Advantage Plans in Massachusetts 2026,1,6900,high,none,screener,,,n,n,,"CMS-State-County-Penetration-May2026,KFF-MA-2025-enrollment,KFF-2026-Spotlight,NerdWallet-MA,MedicareGuide-MA,US-News-MA,eHealth-MA","Big absolute pool, lower penetration; MA-vs-Medigap guaranteed-issue state"
MB-0011,ma-state,/medicare-advantage/washington,washington,WA,Medicare Advantage Plans in Washington 2026,1,6800,high,none,screener,,,n,n,,"CMS-State-County-Penetration-May2026,KFF-MA-2025-enrollment,KFF-2026-Spotlight,NerdWallet-WA,MedicareGuide-WA,US-News-WA,eHealth-WA",Pacific NW lead; Kaiser-WA strength; MA-vs-Medigap guaranteed-issue state
MB-0012,ma-state,/medicare-advantage/indiana,indiana,IN,Medicare Advantage Plans in Indiana 2026,1,6300,high,none,screener,,,n,n,,"CMS-State-County-Penetration-May2026,KFF-MA-2025-enrollment,KFF-2026-Spotlight,NerdWallet-IN,MedicareGuide-IN,US-News-IN,eHealth-IN",Adjudication win — A undervalued IN; ~660K MA shoppers; HIP state brand
MB-0013,ma-state,/medicare-advantage/south-carolina,south-carolina,SC,Medicare Advantage Plans in South Carolina 2026,1,6300,high,none,screener,,,n,n,,"CMS-State-County-Penetration-May2026,KFF-MA-2025-enrollment,KFF-2026-Spotlight,NerdWallet-SC,MedicareGuide-SC,US-News-SC,eHealth-SC",SE prioritized
MB-0014,ma-state,/medicare-advantage/alabama,alabama,AL,Medicare Advantage Plans in Alabama 2026,1,6100,high,none,screener,,,n,n,,"CMS-State-County-Penetration-May2026,KFF-MA-2025-enrollment,KFF-2026-Spotlight,NerdWallet-AL,MedicareGuide-AL,US-News-AL,eHealth-AL",Penetration adjudicated to 57% (B)
MB-0015,ma-state,/medicare-advantage/kentucky,kentucky,KY,Medicare Advantage Plans in Kentucky 2026,1,6000,high,none,screener,,,n,n,,"CMS-State-County-Penetration-May2026,KFF-MA-2025-enrollment,KFF-2026-Spotlight,NerdWallet-KY,MedicareGuide-KY,US-News-KY,eHealth-KY",SE prioritized
MB-0016,ma-state,/medicare-advantage/louisiana,louisiana,LA,Medicare Advantage Plans in Louisiana 2026,1,5800,high,none,screener,,,n,n,,"CMS-State-County-Penetration-May2026,KFF-MA-2025-enrollment,KFF-2026-Spotlight,NerdWallet-LA,MedicareGuide-LA,US-News-LA,eHealth-LA",High penetration (59%)
MB-0017,procedure,/cost/eye-exam,eye-exam,,Eye Exam Cost Without Insurance in 2026: National Pricing Guide,1,4939,medium,none,analyzer,,,n,n,,"bing-stats,bing-related(4),clincalc,goodrx,obvious-50",
MB-0018,ma-state,/medicare-advantage/arkansas,arkansas,AR,Medicare Advantage Plans in Arkansas 2026,1,4500,high,none,screener,,,n,n,,"CMS-State-County-Penetration-May2026,KFF-MA-2025-enrollment,KFF-2026-Spotlight,NerdWallet-AR,MedicareGuide-AR,US-News-AR,eHealth-AR",ARHOME state brand
MB-0019,ma-state,/medicare-advantage/mississippi,mississippi,MS,Medicare Advantage Plans in Mississippi 2026,1,4000,medium,none,screener,,,n,n,,"CMS-State-County-Penetration-May2026,KFF-MA-2025-enrollment,KFF-2026-Spotlight,NerdWallet-MS,MedicareGuide-MS,US-News-MS,eHealth-MS",SE prioritized
MB-0020,qa,/qa/extra-help-eligibility-2026,extra-help-eligibility-2026,,Do I Qualify for Medicare Extra Help (LIS) in 2026?,1,3500,medium,slight,screener,qa-state-eligibility,,n,n,,"Bing-extra-help-21942-broad-1939-strict,Bing-medicare-extra-help-6989-broad,CU-120-overlap,critique-§4-bump",Slug from B (year-anchored per critique §6.6). Demand bumped from 820 to 3500 per critique §4.
MB-0021,ma-state,/medicare-advantage/west-virginia,west-virginia,WV,Medicare Advantage Plans in West Virginia 2026,1,3300,medium,none,screener,,,n,n,,"CMS-State-County-Penetration-May2026,KFF-MA-2025-enrollment,KFF-2026-Spotlight,NerdWallet-WV,MedicareGuide-WV,US-News-WV,eHealth-WV",SE prioritized
MB-0022,qa,/qa/chip-eligibility-by-state,chip-eligibility-by-state,,CHIP Eligibility by State in 2026: Income Limits for Children (51-Fork),1,3200,medium,slight,screener,qa-state-eligibility,,n,n,,"CMS-CHIP-state-directory,critique-§2-additions,FANOUT-4.4-CHIP-variant",NEW 51-fork per critique §2. BUSA overlap corrected heavy→slight (CHIP brand variants underserved by BUSA per §5). Per critique §6.7 — build here until CHIP-factory exists.
MB-0023,qa,/qa/medicare-savings-program-by-state,medicare-savings-program-by-state,,Medicare Savings Programs (QMB/SLMB/QI) by State 2026 (51-Fork),1,3000,medium,none,screener,qa-state-eligibility,,n,n,,"Bing-medicare-savings-program-7558-broad,Bing-qmb-13183-broad,CU-104-queued,critique-§2-additions",NEW 51-fork per critique §2. State-MSP-expansion (CT/MN/ME/NY) above federal floors lives here per critique §3.3.
MB-0024,procedure,/cost/ivf-alabama,ivf-alabama,AL,Alabama IVF Cost Without Insurance in 2026: National Pricing Guide,1,2735,high,none,analyzer,,,n,n,,"bing-stats,clincalc,fertilityiq,resolve,obvious-50",State-fork from procedure ivf-cost
MB-0025,procedure,/cost/ivf-arkansas,ivf-arkansas,AR,Arkansas IVF Cost Without Insurance in 2026: National Pricing Guide,1,2735,high,none,analyzer,,,n,n,,"bing-stats,clincalc,fertilityiq,resolve,obvious-50",State-fork from procedure ivf-cost
MB-0026,procedure,/cost/ivf-florida,ivf-florida,FL,Florida IVF Cost Without Insurance in 2026: National Pricing Guide,1,2735,high,none,analyzer,,,n,n,,"bing-stats,clincalc,fertilityiq,resolve,obvious-50",State-fork from procedure ivf-cost
MB-0027,procedure,/cost/ivf-georgia,ivf-georgia,GA,Georgia IVF Cost Without Insurance in 2026: National Pricing Guide,1,2735,high,none,analyzer,,,n,n,,"bing-stats,clincalc,fertilityiq,resolve,obvious-50",State-fork from procedure ivf-cost
MB-0028,procedure,/cost/ivf-kentucky,ivf-kentucky,KY,Kentucky IVF Cost Without Insurance in 2026: National Pricing Guide,1,2735,high,none,analyzer,,,n,n,,"bing-stats,clincalc,fertilityiq,resolve,obvious-50",State-fork from procedure ivf-cost
MB-0029,procedure,/cost/ivf-louisiana,ivf-louisiana,LA,Louisiana IVF Cost Without Insurance in 2026: National Pricing Guide,1,2735,high,none,analyzer,,,n,n,,"bing-stats,clincalc,fertilityiq,resolve,obvious-50",State-fork from procedure ivf-cost
MB-0030,procedure,/cost/ivf-mississippi,ivf-mississippi,MS,Mississippi IVF Cost Without Insurance in 2026: National Pricing Guide,1,2735,high,none,analyzer,,,n,n,,"bing-stats,clincalc,fertilityiq,resolve,obvious-50",State-fork from procedure ivf-cost
MB-0031,procedure,/cost/ivf-north-carolina,ivf-north-carolina,NC,North Carolina IVF Cost Without Insurance in 2026: National Pricing Guide,1,2735,high,none,analyzer,,,n,n,,"bing-stats,clincalc,fertilityiq,resolve,obvious-50",State-fork from procedure ivf-cost
MB-0032,procedure,/cost/ivf-south-carolina,ivf-south-carolina,SC,South Carolina IVF Cost Without Insurance in 2026: National Pricing Guide,1,2735,high,none,analyzer,,,n,n,,"bing-stats,clincalc,fertilityiq,resolve,obvious-50",State-fork from procedure ivf-cost
MB-0033,procedure,/cost/ivf-tennessee,ivf-tennessee,TN,Tennessee IVF Cost Without Insurance in 2026: National Pricing Guide,1,2735,high,none,analyzer,,,n,n,,"bing-stats,clincalc,fertilityiq,resolve,obvious-50",State-fork from procedure ivf-cost
MB-0034,procedure,/cost/ivf-virginia,ivf-virginia,VA,Virginia IVF Cost Without Insurance in 2026: National Pricing Guide,1,2735,high,none,analyzer,,,n,n,,"bing-stats,clincalc,fertilityiq,resolve,obvious-50",State-fork from procedure ivf-cost
MB-0035,procedure,/cost/ivf-west-virginia,ivf-west-virginia,WV,West Virginia IVF Cost Without Insurance in 2026: National Pricing Guide,1,2735,high,none,analyzer,,,n,n,,"bing-stats,clincalc,fertilityiq,resolve,obvious-50",State-fork from procedure ivf-cost
MB-0036,qa,/qa/does-medicare-cover-ozempic,does-medicare-cover-ozempic,,Does Medicare Cover Ozempic in 2026? (Type 2 vs Weight-Loss Rules),1,2400,high,none,screener,qa-coverage,,n,n,,"Bing-ozempic-100-related-30k-volume,medicare.gov,goodrx,kff",Long-tail year+policy angle per critique §7. Cover Type-2 vs WL distinction.
MB-0037,qa,/qa/aca-marketplace-subsidy-eligibility-2026,aca-marketplace-subsidy-eligibility-2026,,Do I Qualify for ACA Marketplace Subsidies in 2026? Income Limits Explained,1,2400,high,heavy,screener,qa-state-eligibility,,n,n,,"Bing-marketplace-8720k-broad,BUSA-state-aca-eligibility-overlap-confirmed,healthcare.gov,kff",National Q&A only. Skip state-fork (BUSA owns state-ACA eligibility per critique §5).
MB-0038,qa,/qa/state-pharmaceutical-assistance-programs,state-pharmaceutical-assistance-programs,,State Pharmaceutical Assistance Programs (SPAPs) by State 2026,1,2200,low,none,screener,qa-state-eligibility,,n,n,,"medicare.gov-spap-directory,critique-§3-additions","NEW per critique §3. ~20 states run SPAPs (NY EPIC, NJ PAAD, PA PACE/PACENET, MA Prescription Advantage). BUSA doesn't cover."
MB-0039,glossary,/glossary/hmo-vs-ppo-vs-epo-vs-pos,hmo-vs-ppo-vs-epo-vs-pos,,HMO vs PPO vs EPO vs POS: 2026 Plan Type 4-Way Comparison,1,2027,medium,none,screener,,comparison-2hop,n,n,,bing-GetKeyword-broad-13wk|hmo-ppo-7.2k-broad,Critic-mandated 4-way; subsumes A's 3-way + B's POS standalone
MB-0040,qa,/qa/obamacare-still-available-2026,obamacare-still-available-2026,,Is ACA / Obamacare Still Available in 2026? (Post-OBBB Changes),1,2000,medium,none,screener,qa-coverage,,n,n,,"Bing-obamacare-20909-broad,2025-OBBB-eligibility-changes,critique-§4-bump-to-P1",Demand bumped from 720 to 2000 per critique §4 — OBBB policy news angle.
MB-0041,qa,/qa/does-medicare-cover-hearing-aids,does-medicare-cover-hearing-aids,,Does Medicare Cover Hearing Aids in 2026?,1,1900,high,none,screener,qa-coverage,,n,n,,"Bing-does-medicare-cover-hearing-aids-2487-broad-1868-strict-corrected,medicare.gov,aarp,humana",Demand corrected from 3200 to 1900 (strict-match per critique §4 — A was double-counting broad).
MB-0042,qa,/qa/does-medicare-cover-wegovy,does-medicare-cover-wegovy,,Does Medicare Cover Wegovy in 2026? (Cardiovascular Indication),1,1900,high,none,screener,qa-coverage,,n,n,,"Bing-does-medicare-cover-wegovy-1522-broad-1224-strict,kff,goodrx",CV indication is the 2024+ policy hook.
MB-0043,procedure,/cost/dexa-scan,dexa-scan,,DEXA Bone Density Scan Cost Without Insurance in 2026: National Pricing Guide,1,1777,medium,none,analyzer,,,n,n,,"bing-stats,clincalc,goodrx,obvious-50",
MB-0044,glossary,/glossary/epo-vs-ppo,epo-vs-ppo,,EPO vs PPO: 2026 Plan Type Differences Explained,1,1769,medium,none,screener,,comparison-2hop,n,n,,bing-GetKeyword-broad-13wk,Strong 2-hop demand
MB-0045,glossary,/glossary/in-network-vs-out-of-network-coinsurance,in-network-vs-out-of-network-coinsurance,,In-Network vs Out-of-Network Coinsurance: 2026 Cost Differences,1,1651,medium,none,screener,,comparison-2hop,n,n,,bing-GetKeyword-broad-13wk-out-of-network|critic-mandated,Critic-mandated cost-side reframe; analyzer funnel
MB-0046,procedure,/cost/wisdom-teeth-removal,wisdom-teeth-removal,,Wisdom Teeth Removal Cost Without Insurance in 2026: National Pricing Guide,1,1593,high,none,analyzer,,,n,n,,"bing-stats,bing-related(1),clincalc,goodrx,carecredit,obvious-50",
MB-0047,glossary,/glossary/copay-deductible-coinsurance,copay-deductible-coinsurance,,Copay vs Deductible vs Coinsurance: 2026 Health Insurance Terms Explained,1,1500,medium,none,screener,,comparison-2hop,n,y,CU-149,already_queued-CU-149|bing-cluster,Merges 3 head terms; already queued CU-149
MB-0048,qa,/qa/does-medicare-cover-glp1-weight-loss,does-medicare-cover-glp1-weight-loss,,Does Medicare Cover GLP-1 Drugs for Weight Loss in 2026? (Class Umbrella),1,1400,medium,none,screener,qa-coverage,,n,n,,"kff,goodrx,cms,FANOUT-4.3-class-umbrella",Class umbrella per critique §6 adjudication — keep umbrella + per-drug pages.
MB-0049,qa,/qa/does-medicare-cover-mental-health,does-medicare-cover-mental-health,,Does Medicare Cover Mental Health Care in 2026?,1,1400,high,none,screener,qa-coverage,,n,n,,"Bing-therapy-insurance-related,medicare.gov/coverage/mental-health-care,aarp,kff",
MB-0050,qa,/qa/does-medicaid-cover-nursing-home,does-medicaid-cover-nursing-home,,Does Medicaid Cover Nursing Home Care in 2026? (Income/Asset Rules),1,1400,medium,slight,screener,qa-coverage,,n,n,,"medicaid.gov,kff,ncoa",
MB-0051,qa,/qa/medicare-vs-medicaid-coverage,medicare-vs-medicaid-coverage,,Medicare vs Medicaid: What's the Difference in Coverage in 2026?,1,1400,high,slight,screener,qa-coverage,,n,n,,"medicare.gov,medicaid.gov,kff,aarp",
MB-0052,qa,/qa/medicaid-vs-medicare-eligibility,medicaid-vs-medicare-eligibility,,Medicaid vs Medicare: Who Qualifies for Each in 2026?,1,1400,high,slight,screener,qa-coverage,,n,n,,"Bing-what-is-medicaid-8794-broad,competitor-landscape-3-AARP-NCOA-coverage",
MB-0053,qa,/qa/medicaid-immigrant-coverage-by-state,medicaid-immigrant-coverage-by-state,,Medicaid Coverage for Immigrants by State 2026 (CA/NY/IL/MA/OR/WA Expansion),1,1400,medium,slight,screener,qa-state-eligibility,,n,n,,"medicaid.gov,nilc,kff,critique-§2-§3-additions",NEW per critique §2/§3. CA/NY/IL/MA/OR/WA full undocumented expansion is politically hot 2026.
MB-0054,qa,/qa/pregnancy-medicaid-by-state,pregnancy-medicaid-by-state,,Pregnancy Medicaid Eligibility by State 2026: Income Limits & Coverage,1,1400,medium,slight,screener,qa-state-eligibility,,n,n,,"medicaid.gov,cms,kff,march-of-dimes,critique-§3-additions",NEW 51-fork per critique §3. National = pregnancy coverage Q&A; state-fork = income-cliff variation (200%+ FPL states).
MB-0055,qa,/qa/does-medicare-cover-nursing-home,does-medicare-cover-nursing-home,,Does Medicare Cover Nursing Home Care in 2026? (100-Day Cap),1,1300,high,none,screener,qa-coverage,,n,n,,"medicare.gov/coverage/long-term-care,aarp,ncoa,kff",
MB-0056,qa,/qa/does-medicaid-cover-dental-adults,does-medicaid-cover-dental-adults,,Does Medicaid Cover Dental for Adults in 2026? (State-by-State),1,1300,high,slight,screener,qa-coverage,,n,n,,"CMS-state-Medicaid-dental-tracker,medicaid.gov,kff,critique-§5-busa-overlap-corrected",BUSA overlap corrected none→slight per critique §5. Scales 51x.
MB-0057,procedure,/cost/cologuard,cologuard,,Cologuard Cost Without Insurance in 2026: Stool DNA Test Pricing Guide,1,1230,medium,none,analyzer,,,n,n,,"bing-stats,clincalc",
MB-0058,qa,/qa/is-ozempic-covered-by-insurance,is-ozempic-covered-by-insurance,,Is Ozempic Covered by Insurance in 2026? (Type 2 vs Weight Loss),1,1200,high,none,screener,qa-coverage,,n,n,,"Bing-ozempic-100-related-30k-volume,goodrx,kff",
MB-0059,procedure,/cost/vasectomy,vasectomy,,Vasectomy Cost Without Insurance in 2026: National Pricing Guide,1,1139,medium,none,analyzer,,,n,n,,"bing-stats,bing-related(1),clincalc,goodrx,plannedparenthood,obvious-50",
MB-0060,procedure,/cost/ambulance,ambulance,,Ambulance Ride Cost Without Insurance in 2026: Ground & Air Pricing Guide,1,1131,medium,slight,analyzer,,,n,n,,"bing-stats,bing-related(1),clincalc,kff,goodrx,obvious-50",critique: BUSA slight overlap (bill-help vs price-lookup)
MB-0061,drug,/drug/wegovy,wegovy-cost,,"Wegovy Cost in 2026: Without Insurance, NovoCare Self-Pay, Manufacturer Assistance",1,1100,high,none,analyzer,,,n,n,,bing|clincalc|goodrx-catalog|manufacturer-site,Highest-volume GLP-1 cost query not yet shipped
MB-0062,persona,/for/children-kids,children-kids,,Health Insurance for Kids 2026: CHIP vs Medicaid vs Family Marketplace Plan,1,1100,medium,slight,screener,,,n,y,CU-196,"bing-stats(24-strict-22weeks),bing-related(13113)(healthy-kids)+(297)(health-insurance-for-kids)+(540)(chip-medicaid),Census-children-uninsured,B(KFF+HealthCare.gov)",
MB-0063,qa,/qa/does-medicaid-cover-glp1-by-state,does-medicaid-cover-glp1-by-state,,Does Medicaid Cover GLP-1 for Weight Loss by State in 2026? (51-Fork),1,1100,medium,slight,screener,qa-coverage,,n,n,,"kff-state-medicaid-glp1-tracker,critique-§2,B-misplaced-drug-template-state-fork",State-fork (51 pages). Critique §2 + drug-critique rerouted here. CA/NC/PA/CT cover; most don't. Hottest 2026 state-fork.
MB-0064,qa,/qa/does-medicare-cover-eye-exams,does-medicare-cover-eye-exams,,Does Medicare Cover Eye Exams in 2026?,1,1100,medium,none,screener,qa-coverage,,n,n,,"Bing-vision-coverage-related,medicare.gov,humana,aarp",
MB-0065,qa,/qa/does-medicare-cover-cataract-surgery,does-medicare-cover-cataract-surgery,,Does Medicare Cover Cataract Surgery in 2026?,1,1100,high,none,screener,qa-coverage,,n,n,,"medicare.gov/coverage/cataract-surgery,aarp,allaboutvision",
MB-0066,qa,/qa/does-medicare-cover-therapy,does-medicare-cover-therapy,,Does Medicare Cover Therapy and Counseling in 2026?,1,1100,high,none,screener,qa-coverage,,n,n,,"medicare.gov,aarp,psychologytoday",
MB-0067,qa,/qa/who-qualifies-for-aca-subsidy,who-qualifies-for-aca-subsidy,,Who Qualifies for ACA Subsidies in 2026? (Income Cliff After 400% FPL),1,1100,medium,heavy,screener,qa-coverage,,n,n,,"BUSA-aca-eligibility-overlap-heavy,2026-subsidy-cliff-restored,critique-§5-corrected-heavy",BUSA overlap corrected slight→heavy per critique §5. Skip state forks (BUSA owns those).
MB-0068,procedure,/cost/knee-replacement,knee-replacement,,Knee Replacement Cost Without Insurance in 2026 (CPT 27447),1,1023,high,none,analyzer,,,n,n,,"bing-stats,bing-related(3),clincalc,goodrx,kff,cms,obvious-50",already_queued
MB-0069,persona,/for/veterans,veterans,,Health Insurance for Veterans 2026: VA + TRICARE + Marketplace Coverage Stack,1,1000,high,slight,screener,,,n,n,,"bing-stats(46-weekly-broad),bing-related(394137-deflated-per-critique),VA-utilization-stats,B(VA.gov+Military.com+AmericanDiabetes+AmericanCancerSociety)",Critique demand_score deflated from 2400 (brand non-coverage intent)
MB-0070,persona,/for/1099-contractors,1099-contractors,,Health Insurance for 1099 Contractors 2026: Coverage + SE Tax Deduction Guide,1,940,high,slight,screener,,,n,n,,"bing-related(1099),bing-related(602)(health-insurance-for-self-employed),IRS-Form-1099-NEC-stats,competitor-landscape-§6,CONTENT_INVENTORY-CU-220,B(Stride+HealthCare.gov+GoodRx+HSAforAmerica)",
MB-0071,procedure,/cost/urgent-care,urgent-care,,Urgent Care Visit Cost Without Insurance in 2026: National Pricing Guide,1,923,medium,none,analyzer,,,n,n,,"bing-stats,clincalc,goodrx,nerdwallet,obvious-50",already_queued
MB-0072,qa,/qa/does-medicaid-cover-ozempic,does-medicaid-cover-ozempic,,Does Medicaid Cover Ozempic and GLP-1 Drugs in 2026?,1,920,medium,slight,screener,qa-coverage,,n,n,,"kff,goodrx,medicaid.gov,Bing-ozempic-related-100,FANOUT-4.3",National coverage Q&A. Companion to state-fork page below.
MB-0073,qa,/qa/does-medicare-cover-insulin,does-medicare-cover-insulin,,Does Medicare Cover Insulin in 2026? ($35 Cap),1,920,medium,none,screener,qa-coverage,,n,n,,"medicare.gov,cms,kff,IRA-Part-D-insulin-cap",
MB-0074,qa,/qa/does-medicare-cover-colonoscopy,does-medicare-cover-colonoscopy,,Does Medicare Cover Colonoscopy Screening in 2026?,1,920,high,none,screener,qa-coverage,,n,n,,"medicare.gov/coverage/colonoscopies,aarp,cancer.org",
MB-0075,qa,/qa/does-medicare-cover-home-health,does-medicare-cover-home-health,,Does Medicare Cover Home Health Care in 2026?,1,920,high,none,screener,qa-coverage,,n,n,,"medicare.gov/coverage/home-health-services,aarp,ncoa",
MB-0076,qa,/qa/does-medicare-advantage-cover-dental,does-medicare-advantage-cover-dental,,Does Medicare Advantage Cover Dental in 2026? (Bonus Benefit Breakdown),1,920,medium,none,screener,qa-coverage,,n,n,,"Bing-medicare-advantage-100-related,FANOUT-4.3-MA-add-on-shape,critique-§7-long-tail-promote",Promoted per critique §7 — year+MA-fork long-tail.
MB-0077,qa,/qa/does-medicaid-cover-mental-health,does-medicaid-cover-mental-health,,Does Medicaid Cover Mental Health Care in 2026?,1,920,high,none,screener,qa-coverage,,n,y,CU-144,"medicaid.gov,kff,samhsa",
MB-0078,qa,/qa/medicare-advantage-vs-original-medicare,medicare-advantage-vs-original-medicare,,Medicare Advantage vs Original Medicare: Coverage Differences in 2026,1,920,high,none,screener,qa-coverage,,n,n,,"medicare.gov,kff,aarp",
MB-0079,qa,/qa/is-medicare-free,is-medicare-free,,Is Medicare Free in 2026? (Premium Breakdown by Part),1,920,medium,none,screener,qa-coverage,,n,n,,"Bing-what-is-medicare-part-b-7243-broad,medicare.gov,critique-§6.10",A wins (B missing). Basic premium-by-Part Q&A is real demand.
MB-0080,qa,/qa/is-wegovy-covered-by-insurance,is-wegovy-covered-by-insurance,,Is Wegovy Covered by Insurance in 2026?,1,920,medium,none,screener,qa-coverage,,n,n,,"Bing-wegovy-100-related,kff,goodrx",
MB-0081,qa,/qa/can-i-get-medicare-under-65,can-i-get-medicare-under-65,,Can I Get Medicare Under 65 in 2026? (Disability / ESRD / ALS),1,920,medium,none,screener,qa-coverage,,n,n,,"CMS-Medicare-disability-rule,SSA-SSDI-24-month-waiting-period",
MB-0082,qa,/qa/do-i-qualify-medicaid-no-income,do-i-qualify-medicaid-no-income,,Do I Qualify for Medicaid With No Income in 2026?,1,920,medium,slight,screener,qa-coverage,,n,n,,"Bing-qualify-for-medicaid-3191-broad,Bing-how-to-qualify-for-medicaid-1503,FANOUT-4.4-extension",
MB-0083,qa,/qa/medicaid-immigrant-eligibility,medicaid-immigrant-eligibility,,Can Immigrants Get Medicaid in 2026? (Five-Year Bar + State Options),1,920,medium,slight,screener,qa-state-eligibility,,n,n,,"medicaid.gov,nilc,kff",National Q&A companion (priority adjudicated B wins per critique §6.8).
MB-0084,qa,/qa/medicaid-long-term-care-eligibility,medicaid-long-term-care-eligibility,,Do I Qualify for Medicaid Long-Term Care in 2026? (Nursing Home + HCBS),1,920,medium,slight,screener,qa-state-eligibility,,n,n,,"medicaid.gov,kff,aarp",
MB-0085,qa,/qa/dental-coverage-by-state-medicaid,dental-coverage-by-state-medicaid,,Adult Dental Medicaid Coverage by State 2026 (Full Comparison),1,920,medium,slight,screener,qa-state-eligibility,,n,n,,"medicaid.gov,cms,kff",
MB-0086,qa,/qa/does-medicare-cover-mounjaro-2026,does-medicare-cover-mounjaro-2026,,Does Medicare Cover Mounjaro in 2026?,1,900,high,none,screener,qa-coverage,,n,n,,"goodrx,kff,GLP-1-class-extension,Bing-mounjaro-related",State-fork: state Medicaid GLP-1 variation is the 2026 angle (critique additions §2).
MB-0087,qa,/qa/state-medicaid-expansion-status,state-medicaid-expansion-status,,Is Medicaid Expanded in My State in 2026? (Non-Expansion State Map),1,900,medium,none,screener,qa-state-eligibility,,n,n,,"KFF-Medicaid-expansion-tracker,FANOUT-4.4-expansion-status-shape",
MB-0088,glossary,/glossary/medicare-advantage-vs-original-plus-medigap,medicare-advantage-vs-original-plus-medigap,,Medicare Advantage vs Original Medicare + Medigap + Part D: 2026 Decision,1,870,medium,slight,screener,,comparison-2hop,n,n,,already_queued-CU-209|bing-related|critic-mandated,Critic-mandated 3-way; replaces both A's separate MA-vs-Medigap and Original-vs-MA pages; broker-funnel-critical
MB-0089,drug,/drug/zepbound,zepbound-cost,,"Zepbound Cost in 2026: LillyDirect Self-Pay, Insurance, and GLP-1 Bridge",1,850,high,none,analyzer,,,n,n,,bing|clincalc|goodrx-catalog|medicare-bridge-program-2026,LillyDirect vial pricing angle
