url,title,page_type,topic_bucket,lang,blog_date,sitemap_lastmod,has_es
https://benefitsusa.org/ak, / ak,state-shortcut,Other/Mixed,,,2026-05-15,y
https://benefitsusa.org/ak/es, / ak / es,other,Other/Mixed,,,,
https://benefitsusa.org/al, / al,state-shortcut,Other/Mixed,,,2026-05-15,y
https://benefitsusa.org/al/es, / al / es,other,Other/Mixed,,,,
https://benefitsusa.org/ar, / ar,state-shortcut,Other/Mixed,,,2026-05-15,y
https://benefitsusa.org/ar/es, / ar / es,other,Other/Mixed,,,,
https://benefitsusa.org/az, / az,state-shortcut,Other/Mixed,,,2026-05-15,y
https://benefitsusa.org/az/es, / az / es,other,Other/Mixed,,,,
https://benefitsusa.org/ca, / ca,state-shortcut,Other/Mixed,,,2026-05-15,y
https://benefitsusa.org/ca/es, / ca / es,other,Other/Mixed,,,,
https://benefitsusa.org/co, / co,state-shortcut,Other/Mixed,,,2026-05-15,y
https://benefitsusa.org/co/es, / co / es,other,Other/Mixed,,,,
https://benefitsusa.org/ct, / ct,state-shortcut,Other/Mixed,,,2026-05-15,y
https://benefitsusa.org/ct/es, / ct / es,other,Other/Mixed,,,,
https://benefitsusa.org/dc, / dc,state-shortcut,Other/Mixed,,,2026-05-15,y
https://benefitsusa.org/dc/es, / dc / es,other,Other/Mixed,,,,
https://benefitsusa.org/de, / de,state-shortcut,Other/Mixed,,,2026-05-15,y
https://benefitsusa.org/de/es, / de / es,other,Other/Mixed,,,,
https://benefitsusa.org/en/,home,home,Other/Mixed,en,,2026-05-15,y
https://benefitsusa.org/en/about,about,utility-page,Other/Mixed,en,,2026-05-15,y
https://benefitsusa.org/en/benefits-eligibility-chart,benefits eligibility chart,utility-page,Other/Mixed,en,,2026-05-15,y
https://benefitsusa.org/en/blog,blog,blog-index,Other/Mixed,en,,2026-05-15,y
https://benefitsusa.org/en/blog/2025-federal-poverty-level-chart,"'2025 Federal Poverty Guidelines: $15,650 for 1 Person'",blog-post,Tax/Income,en,2026-03-06T00:00:00.000Z,2026-03-06,y
https://benefitsusa.org/en/blog/aca-subsidies-expiring-2026,ACA Subsidy Cliff 2026: Enhanced Marketplace Subsidies Set to Expire,blog-post,ACA,en,2026-02-22,2026-02-22,y
https://benefitsusa.org/en/blog/acp-replacement-2025,Affordable Connectivity Program Replacement vs Lifeline: Internet Discounts in 2025,blog-post,Other/Mixed,en,2026-03-11,2026-03-11,y
https://benefitsusa.org/en/blog/add-person-to-snap-case,How to Add a New Household Member to Your Benefits Case,blog-post,SNAP,en,2026-04-14,2026-04-14,y
https://benefitsusa.org/en/blog/adoption-subsidy-and-food-stamps,How Adoption Subsidies Interact with Benefits,blog-post,ACA,en,2026-05-08,2026-05-08,y
https://benefitsusa.org/en/blog/affordable-connectivity-program-status,Emergency Broadband Benefit / Affordable Connectivity Program Successor,blog-post,Other/Mixed,en,2026-04-04,2026-04-04,y
https://benefitsusa.org/en/blog/aging-out-of-foster-care-at-18-benefits,Turning 18 in Foster Care: Independent Living Benefits You Can Claim,blog-post,Other/Mixed,en,2026-03-29,2026-03-29,y
https://benefitsusa.org/en/blog/aging-parent-moving-in-benefits-multigenerational-households,Aging Parent Moving In: Benefits for Multigenerational Households,blog-post,Other/Mixed,en,2026-02-24,2026-02-24,y
https://benefitsusa.org/en/blog/alabama-aca-benefits-and-coverage,Alabama ACA Benefits and Coverage: Your Complete Guide to Marketplace Health Insurance,blog-post,ACA,en,2025-02-15,2025-02-15,y
https://benefitsusa.org/en/blog/alabama-aca-calculator,Alabama ACA Calculator: How to Estimate Your 2026 Marketplace Subsidies,blog-post,ACA,en,2026-05-12,2026-05-12,y
https://benefitsusa.org/en/blog/alabama-aca-eligibility-2026,"Alabama ACA Eligibility 2026: Income Limits, Subsidies, and How to Enroll",blog-post,ACA,en,2026-03-26,2026-03-26,y
https://benefitsusa.org/en/blog/alabama-medicaid-eligibility-2026,"Alabama Medicaid Eligibility 2026: Income Limits, Requirements, and How to Apply",blog-post,Medicaid,en,2026-02-27,2026-02-27,y
https://benefitsusa.org/en/blog/alabama-medicaid-income-limits-2026,Alabama Medicaid Income Limits 2026,blog-post,Medicaid,en,2026-05-04,2026-05-04,y
https://benefitsusa.org/en/blog/alabama-snap-eligibility-2026,Alabama SNAP Eligibility 2026,blog-post,SNAP,en,2026-04-25,2026-04-25,y
https://benefitsusa.org/en/blog/alaska-aca-benefits-and-coverage,Alaska ACA Benefits and Coverage: Your Complete 2025 Guide,blog-post,ACA,en,2025-02-15,2025-02-15,y
https://benefitsusa.org/en/blog/alaska-aca-eligibility-2026,"Alaska ACA Eligibility 2026: Income Limits, Subsidies, and How to Enroll",blog-post,ACA,en,2026-03-26,2026-03-26,y
https://benefitsusa.org/en/blog/alaska-medicaid-eligibility-2026,"Alaska Medicaid Eligibility 2026: Income Limits, How to Apply, and Who Qualifies",blog-post,Medicaid,en,2026-02-27,2026-02-27,y
https://benefitsusa.org/en/blog/alaska-medicaid-income-limits-2026,Alaska Medicaid Income Limits 2026,blog-post,Medicaid,en,2026-05-04,2026-05-04,y
https://benefitsusa.org/en/blog/alaska-snap-eligibility-2026,Alaska SNAP Eligibility 2026,blog-post,SNAP,en,2026-04-25,2026-04-25,y
https://benefitsusa.org/en/blog/apply-for-disability-ssi-for-a-child,How to Apply for Disability (SSI) for a Child,blog-post,SSDI/Disability,en,2026-04-18,2026-04-18,y
https://benefitsusa.org/en/blog/arizona-aca-benefits-and-coverage,Arizona ACA Benefits and Coverage: Your Complete Guide to Marketplace Health Insurance,blog-post,ACA,en,2026-02-15,2026-02-15,
https://benefitsusa.org/en/blog/arizona-aca-eligibility-2026,"Arizona ACA Eligibility 2026: Income Limits, Subsidies, and How to Enroll",blog-post,ACA,en,2026-03-28,2026-03-28,y
https://benefitsusa.org/en/blog/arizona-medicaid-eligibility-2026,Arizona Medicaid Eligibility 2026: AHCCCS Guide,blog-post,Medicaid,en,2026-02-13,2026-02-13,y
https://benefitsusa.org/en/blog/arizona-medicaid-income-limits-2026,Arizona Medicaid Income Limits 2026,blog-post,Medicaid,en,2026-05-03,2026-05-03,y
https://benefitsusa.org/en/blog/arizona-snap-eligibility-2026,Arizona SNAP Eligibility 2026,blog-post,SNAP,en,2026-04-26,2026-04-26,y
https://benefitsusa.org/en/blog/arkansas-aca-benefits-and-coverage,Arkansas ACA Benefits and Coverage: Your Complete 2026 Guide,blog-post,ACA,en,2026-02-15,2026-02-15,
https://benefitsusa.org/en/blog/arkansas-aca-calculator,Arkansas ACA Calculator: Estimate Your 2026 Subsidy in Minutes,blog-post,ACA,en,2026-05-13,2026-05-13,y
https://benefitsusa.org/en/blog/arkansas-aca-eligibility-2026,"Arkansas ACA Eligibility 2026: Income Limits, Subsidies, and How to Enroll",blog-post,ACA,en,2026-03-28,2026-03-28,y
https://benefitsusa.org/en/blog/arkansas-medicaid-eligibility-2026,"Arkansas Medicaid Eligibility 2026: Income Limits, ARHOME, and How to Apply",blog-post,Medicaid,en,2026-02-28,2026-02-28,y
https://benefitsusa.org/en/blog/arkansas-medicaid-income-limits-2026,Arkansas Medicaid Income Limits 2026,blog-post,Medicaid,en,2026-05-04,2026-05-04,y
https://benefitsusa.org/en/blog/arkansas-snap-eligibility-2026,Arkansas SNAP Eligibility 2026,blog-post,SNAP,en,2026-04-26,2026-04-26,y
https://benefitsusa.org/en/blog/asset-limits-government-benefits,How Asset Limits Work: What You Can Own and Still Get Benefits,blog-post,Other/Mixed,en,2026-02-26,2026-02-26,y
https://benefitsusa.org/en/blog/autism-benefits-government,Receiving an Autism Diagnosis: Benefits for Adults and Children,blog-post,Other/Mixed,en,2026-04-21,2026-04-21,y
https://benefitsusa.org/en/blog/back-to-school-government-benefits,Back-to-School Benefits: Every Program That Helps With School Expenses,blog-post,Other/Mixed,en,2026-03-15,2026-03-15,y
https://benefitsusa.org/en/blog/bankruptcy-and-medicaid-government-benefits-eligibility,How Bankruptcy Affects Government Benefits Eligibility,blog-post,Medicaid,en,2026-04-05,2026-04-05,y
https://benefitsusa.org/en/blog/barber-government-benefits,"Government Benefits for Barbers, Cosmetologists, and Beauty Workers in 2026",blog-post,Other/Mixed,en,2026-03-05,2026-03-05,y
https://benefitsusa.org/en/blog/bartering-income-and-benefits,How Bartering and Trade Affects Benefits Eligibility,blog-post,Tax/Income,en,2026-05-11,2026-05-11,y
https://benefitsusa.org/en/blog/benefits-after-fleeing-abuse-new-state,Benefits for People Fleeing Domestic Violence to a New State,blog-post,Other/Mixed,en,2026-05-02,2026-05-02,y
https://benefitsusa.org/en/blog/benefits-after-incarceration,Benefits After Incarceration: A Complete Guide to Government Assistance for Reentry,blog-post,Other/Mixed,en,2026-02-27,2026-02-27,y
https://benefitsusa.org/en/blog/benefits-after-kids-leave-home,Benefits for Empty Nesters: Programs After Your Kids Leave Home,blog-post,Other/Mixed,en,2026-03-08,2026-03-08,y
https://benefitsusa.org/en/blog/benefits-after-losing-your-job,Government Benefits You Can Get After Losing Your Job,blog-post,Other/Mixed,en,2026-03-16,2026-03-16,y
https://benefitsusa.org/en/blog/benefits-after-prison,How Prison Release Affects Benefits Eligibility and Reinstatement,blog-post,Other/Mixed,en,2026-03-04,2026-03-04,y
https://benefitsusa.org/en/blog/benefits-after-workplace-injury,Workplace Injury: Workers' Comp and Government Benefits Guide,blog-post,Other/Mixed,en,2026-04-24,2026-04-24,y
https://benefitsusa.org/en/blog/benefits-aging-out-foster-care,Benefits for Youth Aging Out of Foster Care,blog-post,Other/Mixed,en,2026-04-30,2026-04-30,y
https://benefitsusa.org/en/blog/benefits-applicant-rights,Your Benefits Rights: What Caseworkers Can't Deny You,blog-post,Other/Mixed,en,2026-03-21,2026-03-21,y
https://benefitsusa.org/en/blog/benefits-at-200-percent-poverty-level,"Program Eligibility Quick-Reference: What You Qualify For at 100%, 138%, 200%, 300% FPL",blog-post,Tax/Income,en,2026-03-12,2026-03-12,y
https://benefitsusa.org/en/blog/benefits-at-20000-income,"All the Benefits You Qualify For at $20,000 a Year",blog-post,Tax/Income,en,2026-02-26,2026-02-26,y
https://benefitsusa.org/en/blog/benefits-at-25000-income,"Benefits at $25,000 a Year: What a Single Person or Small Family Qualifies For",blog-post,Tax/Income,en,2026-02-26,2026-02-26,y
https://benefitsusa.org/en/blog/benefits-at-50000-income,"Benefits at $50,000 a Year: Programs for Moderate-Income Families",blog-post,Tax/Income,en,2026-02-26,2026-02-26,y
https://benefitsusa.org/en/blog/benefits-at-age-60,Turning 60: Benefits You Can Start Accessing,blog-post,Other/Mixed,en,2026-05-05,2026-05-05,y
https://benefitsusa.org/en/blog/benefits-by-income-level,Benefits by Income Level: Total Benefits a Family of Four Can Receive at Every Income Tier,blog-post,Tax/Income,en,2026-02-23,2026-02-23,y
https://benefitsusa.org/en/blog/benefits-citizen-children-undocumented-parents,Can You Get Government Benefits If You're Undocumented But Your Kids Are US Citizens?,blog-post,Other/Mixed,en,2026-03-10,2026-03-10,y
https://benefitsusa.org/en/blog/benefits-cliff-effect-earning-more-losing-more,Benefits Cliff Effect: How Earning More Can Mean Losing More,blog-post,Other/Mixed,en,2026-04-10,2026-04-10,y
https://benefitsusa.org/en/blog/benefits-cliff-getting-a-raise,Receiving a Raise: Benefits You Might Lose (Benefits Cliff),blog-post,Other/Mixed,en,2026-02-25,2026-02-25,y
https://benefitsusa.org/en/blog/benefits-counselor-near-me,How to Find a Benefits Counselor or Navigator Near You,blog-post,Other/Mixed,en,2026-05-14,2026-05-14,y
https://benefitsusa.org/en/blog/benefits-domestic-violence-survivors,Benefits for Domestic Violence Survivors: Complete Guide to Government Assistance Programs,blog-post,Other/Mixed,en,2026-03-17,2026-03-17,y
https://benefitsusa.org/en/blog/benefits-eligibility-checker-app,Best Apps and Websites to Check Your Benefits Eligibility in 2026,blog-post,Other/Mixed,en,2026-03-14,2026-03-14,y
https://benefitsusa.org/en/blog/benefits-ending-at-19,Turning 19: Benefits That End and Begin for Young Adults,blog-post,Other/Mixed,en,2026-05-03,2026-05-03,y
https://benefitsusa.org/en/blog/benefits-for-15k-income,2026 SNAP Income Limits by State + 6 Benefits for $15K,blog-post,SNAP,en,2026-02-25T00:00:00.000Z,2026-02-25,y
https://benefitsusa.org/en/blog/benefits-for-18-year-old-no-college,Benefits for 18 Year Olds Not Going to College: Complete Guide to Programs You Qualify For,blog-post,Other/Mixed,en,2026-04-01,2026-04-01,y
https://benefitsusa.org/en/blog/benefits-for-60-year-olds,Benefits for People Aged 60 to 64: The Gap Before Medicare,blog-post,Medicare,en,2026-04-01,2026-04-01,y
https://benefitsusa.org/en/blog/benefits-for-blended-families,Government Benefits for Blended and Stepfamilies: Complete 2025 Guide,blog-post,Other/Mixed,en,2026-03-30,2026-03-30,y
https://benefitsusa.org/en/blog/benefits-for-disabled-people-beyond-ssi,Benefits Guide for People With Disabilities (Non-SSI/SSDI),blog-post,SSDI/Disability,en,2026-04-24,2026-04-24,y
https://benefitsusa.org/en/blog/benefits-for-families-with-twins,"Government Benefits for Twins, Triplets, and Multiple Birth Families",blog-post,Other/Mixed,en,2026-04-05,2026-04-05,y
https://benefitsusa.org/en/blog/benefits-for-family-caregivers,Benefits for Caregivers of Elderly or Disabled Family Members,blog-post,Other/Mixed,en,2026-04-22,2026-04-22,y
https://benefitsusa.org/en/blog/benefits-for-foster-youth,Benefits for Foster Youth and Former Foster Youth Up to Age 26,blog-post,Other/Mixed,en,2026-04-01,2026-04-01,y
https://benefitsusa.org/en/blog/benefits-for-grandparents-raising-grandchildren,Government Benefits for Grandparents Raising Grandchildren (2026 Guide),blog-post,Other/Mixed,en,2026-03-09,2026-03-09,y
https://benefitsusa.org/en/blog/benefits-for-minimum-wage-workers,Benefits for Minimum Wage Workers in 2025: Complete Guide to Programs You May Qualify For,blog-post,Other/Mixed,en,2026-03-13,2026-03-13,y
https://benefitsusa.org/en/blog/benefits-for-new-baby,Benefits When You Have a New Baby: Programs to Apply for Immediately,blog-post,Other/Mixed,en,2026-02-22,2026-02-22,y
https://benefitsusa.org/en/blog/benefits-for-non-custodial-parents,Government Benefits for Non-Custodial Parents: Programs You May Qualify For,blog-post,Other/Mixed,en,2026-03-01,2026-03-01,y
https://benefitsusa.org/en/blog/benefits-for-parents-of-disabled-children,Government Benefits for Parents of Disabled Children: Complete 2026 Guide,blog-post,Other/Mixed,en,2026-03-16,2026-03-16,y
https://benefitsusa.org/en/blog/benefits-for-seniors-living-alone,"Benefits for Seniors Living Alone: Programs, Income Limits, and How to Apply",blog-post,Tax/Income,en,2026-03-04,2026-03-04,y
https://benefitsusa.org/en/blog/benefits-for-seniors-over-65,Benefits for Seniors Over 65: Every Program You Qualify For,blog-post,Other/Mixed,en,2026-03-28,2026-03-28,y
https://benefitsusa.org/en/blog/benefits-for-teen-parents,Benefits for Teen Parents: Every Program You May Qualify For in 2026,blog-post,Other/Mixed,en,2026-03-26,2026-03-26,y
https://benefitsusa.org/en/blog/benefits-for-undocumented-immigrants,Government Benefits for Undocumented Immigrants: What You Can and Cannot Get in 2026,blog-post,Other/Mixed,en,2026-03-04,2026-03-04,y
https://benefitsusa.org/en/blog/benefits-for-working-poor,Government Benefits for Working Poor: Programs for Employed but Low-Income Americans,blog-post,Tax/Income,en,2026-03-13,2026-03-13,y
https://benefitsusa.org/en/blog/benefits-fraud-prevention-executive-order,Executive Order on Federal Benefits Fraud Prevention: What It Means for Applicants,blog-post,Other/Mixed,en,2026-03-05,2026-03-05,y
https://benefitsusa.org/en/blog/benefits-fraud-what-counts,Benefits Fraud: What It Actually Is and How to Stay Compliant,blog-post,Other/Mixed,en,2026-04-17,2026-04-17,y
https://benefitsusa.org/en/blog/benefits-grandparents-raising-grandchildren,Benefits for Grandparents Raising Grandchildren: Complete Guide to Federal and State Programs,blog-post,Other/Mixed,en,2026-03-23,2026-03-23,y
https://benefitsusa.org/en/blog/benefits-if-hours-cut-at-work,Hours Cut at Work: Benefits You May Qualify for With Reduced Income,blog-post,Tax/Income,en,2026-03-06,2026-03-06,y
https://benefitsusa.org/en/blog/benefits-navigator-help-applying,How Benefits Navigators and Social Workers Can Help You Apply,blog-post,Other/Mixed,en,2026-04-30,2026-04-30,y
https://benefitsusa.org/en/blog/benefits-part-time-workers,Benefits for Part-Time Workers: Programs You Qualify For on Reduced Hours,blog-post,Other/Mixed,en,2026-02-28,2026-02-28,y
https://benefitsusa.org/en/blog/benefits-renewal-calendar,Government Benefits Renewal Calendar: When to Recertify Every Program,blog-post,Other/Mixed,en,2026-03-04,2026-03-04,y
https://benefitsusa.org/en/blog/benefits-sandwich-generation-caring-kids-aging-parents,Benefits Guide for the Sandwich Generation: Caring for Kids and Aging Parents,blog-post,Other/Mixed,en,2026-04-05,2026-04-05,y
https://benefitsusa.org/en/blog/benefits-when-spouse-goes-to-jail,Benefits When Spouse Goes to Jail: Government Assistance for Families Left Behind,blog-post,Other/Mixed,en,2026-03-07,2026-03-07,y
https://benefitsusa.org/en/blog/benefits-when-spouse-is-incarcerated,Benefits for Families of Incarcerated Individuals: Complete Guide to Government Assistance,blog-post,Other/Mixed,en,2026-03-31,2026-03-31,
https://benefitsusa.org/en/blog/benefits-when-turning-65,"Benefits for People Turning 65: Medicare, Medicaid, and Everything Else",blog-post,Medicare,en,2026-03-30,2026-03-30,y
https://benefitsusa.org/en/blog/benefits-while-incarcerated,Government Benefits for Incarcerated Individuals,blog-post,Other/Mixed,en,2026-04-20,2026-04-20,y
https://benefitsusa.org/en/blog/benefits-with-no-income,Benefits You Can Get With No Income at All,blog-post,Tax/Income,en,2026-03-06,2026-03-06,y
https://benefitsusa.org/en/blog/benefits-working-two-jobs,Benefits for People Working Two or More Jobs,blog-post,Other/Mixed,en,2026-05-01,2026-05-01,y
https://benefitsusa.org/en/blog/best-government-benefits-to-combine,Benefits Combinations That Maximize Your Total Value,blog-post,Other/Mixed,en,2026-02-27,2026-02-27,y
https://benefitsusa.org/en/blog/best-states-for-government-benefits,States with Best Government Benefits Programs 2026,blog-post,Other/Mixed,en,2026-02-26T00:00:00.000Z,2026-02-26,y
https://benefitsusa.org/en/blog/bonus-and-food-stamps-benefits-eligibility,How Bonuses Affect Government Benefits Eligibility,blog-post,SNAP,en,2026-04-05,2026-04-05,y
https://benefitsusa.org/en/blog/calfresh-changes-2026,CalFresh Changes 2026: What California Residents Need to Know About New SNAP Rules,blog-post,SNAP,en,2026-03-04,2026-03-04,y
https://benefitsusa.org/en/blog/california-aca-calculator,California ACA Calculator: How to Estimate Your Covered California Subsidy,blog-post,ACA,en,2026-05-12,2026-05-12,y
https://benefitsusa.org/en/blog/california-aca-marketplace-2026,California ACA Marketplace Guide 2026,blog-post,ACA,en,2026-02-05,2026-02-05,y
https://benefitsusa.org/en/blog/california-ebt-deposit-schedule-2026,California EBT Deposit Schedule 2026: When SNAP Benefits Are Loaded,blog-post,SNAP,en,2026-04-18,2026-04-18,y
https://benefitsusa.org/en/blog/california-government-benefits-guide,"California Benefits Guide: CalFresh, Medi-Cal, and Beyond",blog-post,Medicaid,en,2026-05-01,2026-05-01,y
https://benefitsusa.org/en/blog/california-medicaid-eligibility-2026,California Medi-Cal Eligibility 2026: Income Limits Guide,blog-post,Medicaid,en,2026-02-05,2026-02-05,y
https://benefitsusa.org/en/blog/california-section-8-eligibility-2026,California Section 8 Eligibility 2026,blog-post,Housing,en,2026-05-15,2026-05-15,y
https://benefitsusa.org/en/blog/california-snap-eligibility-2026,California SNAP Eligibility 2026: CalFresh Income Limits,blog-post,SNAP,en,2026-02-07,2026-02-07,y
https://benefitsusa.org/en/blog/california-state-disability-insurance,California State Disability Insurance (SDI): Complete Guide to Benefits and Eligibility,blog-post,SSDI/Disability,en,2026-03-23,2026-03-23,y
https://benefitsusa.org/en/blog/can-college-students-get-food-stamps,Can College Students Get Food Stamps? The Student SNAP Eligibility Myth,blog-post,SNAP,en,2026-04-11,2026-04-11,y
https://benefitsusa.org/en/blog/can-employer-fire-you-for-food-stamps,Can You Get Fired for Being on Government Benefits?,blog-post,SNAP,en,2026-04-13,2026-04-13,y
https://benefitsusa.org/en/blog/can-felons-get-food-stamps,Can Felons Get Food Stamps? SNAP Eligibility for People With Criminal Records,blog-post,SNAP,en,2026-03-10,2026-03-10,y
https://benefitsusa.org/en/blog/can-homeless-people-get-food-stamps,Do You Need a Permanent Address to Apply for Benefits?,blog-post,SNAP,en,2026-04-12,2026-04-12,y
https://benefitsusa.org/en/blog/can-homeowners-get-food-stamps,Does Homeownership Disqualify You From Benefits?,blog-post,SNAP,en,2026-04-12,2026-04-12,y
https://benefitsusa.org/en/blog/can-immigrants-get-government-benefits,Can Immigrants Get Government Benefits? Myths vs. Facts,blog-post,Other/Mixed,en,2026-02-22,2026-02-22,y
https://benefitsusa.org/en/blog/can-landlord-find-out-about-benefits,Can Your Landlord Find Out You Get Housing Assistance?,blog-post,Housing,en,2026-04-13,2026-04-13,y
https://benefitsusa.org/en/blog/can-military-get-food-stamps,Can You Get Benefits If You're in the Military or a Military Spouse?,blog-post,SNAP,en,2026-05-13,2026-05-13,y
https://benefitsusa.org/en/blog/can-self-employed-get-benefits,Can You Get Benefits If You're Self-Employed?,blog-post,Other/Mixed,en,2026-05-12,2026-05-12,y
https://benefitsusa.org/en/blog/can-single-men-get-government-benefits,Can Single Men Without Kids Get Government Benefits?,blog-post,Other/Mixed,en,2026-05-12,2026-05-12,y
https://benefitsusa.org/en/blog/can-you-buy-seeds-with-food-stamps,Can You Use SNAP Benefits to Buy Seeds and Plants?,blog-post,SNAP,en,2026-05-13,2026-05-13,y
https://benefitsusa.org/en/blog/can-you-get-benefits-living-with-parents,Can You Get Benefits If You Live With Your Parents?,blog-post,Other/Mixed,en,2026-05-12,2026-05-12,y
https://benefitsusa.org/en/blog/can-you-get-disability-for-depression,Can You Get Disability for Depression? SSDI Guide,blog-post,SSDI/Disability,en,2026-02-10,2026-02-10,y
https://benefitsusa.org/en/blog/can-you-get-food-stamps-with-savings,Can You Get Food Stamps If You Have Savings? The Asset Myth,blog-post,SNAP,en,2026-03-31,2026-03-31,
https://benefitsusa.org/en/blog/can-you-get-snap-and-medicaid-at-the-same-time,Can You Get SNAP and Medicaid at the Same Time? Myths About Benefit Stacking,blog-post,Medicaid,en,2026-05-11,2026-05-11,y
https://benefitsusa.org/en/blog/can-you-go-to-jail-for-food-stamp-overpayment,Can You Be Jailed for Benefit Overpayment?,blog-post,SNAP,en,2026-04-13,2026-04-13,y
https://benefitsusa.org/en/blog/can-you-own-a-car-and-get-food-stamps,Can You Own a Car and Get Government Benefits?,blog-post,SNAP,en,2026-04-11,2026-04-11,y
https://benefitsusa.org/en/blog/can-you-travel-while-on-food-stamps,Can You Travel or Take a Vacation While on Food Stamps?,blog-post,SNAP,en,2026-02-23,2026-02-23,
https://benefitsusa.org/en/blog/capital-gains-and-medicaid,How Capital Gains from Selling Stocks Affect Benefits,blog-post,Medicaid,en,2026-05-02,2026-05-02,y
https://benefitsusa.org/en/blog/car-value-limit-food-stamps-by-state,Car Value Limit for Food Stamps by State: Vehicle Rules for SNAP and Medicaid (2026),blog-post,Medicaid,en,2026-03-04,2026-03-04,y
https://benefitsusa.org/en/blog/charity-care-vs-medicaid,Charity Care vs Medicaid: Hospital Bill Help Compared,blog-post,Medicaid,en,2026-03-28,2026-03-28,y
https://benefitsusa.org/en/blog/check-medicaid-application-status-ohio,Check Your Medicaid Application Status in Ohio,blog-post,Medicaid,en,2026-05-14,2026-05-14,y
https://benefitsusa.org/en/blog/check-ssdi-application-status-online,Check Your SSDI Application Status Online,blog-post,SSDI/Disability,en,2026-04-17,2026-04-17,y
https://benefitsusa.org/en/blog/child-goes-to-college-affect-benefits,Child Leaving for College: Household Changes and Benefits,blog-post,Other/Mixed,en,2026-04-06,2026-04-06,y
https://benefitsusa.org/en/blog/child-ssi-and-family-food-stamps,How Child SSI Benefits Affect Family SNAP and Medicaid,blog-post,Medicaid,en,2026-03-04,2026-03-04,y
https://benefitsusa.org/en/blog/child-support-and-snap-eligibility,How Child Support Payments Affect Your SNAP Eligibility,blog-post,SNAP,en,2026-03-21,2026-03-21,y
https://benefitsusa.org/en/blog/child-tax-credit-and-food-stamps,How Child Tax Credit Affects Benefits Eligibility,blog-post,SNAP,en,2026-04-23,2026-04-23,y
https://benefitsusa.org/en/blog/child-turning-18-benefits-changes,Child Turning 18: Benefits That Change or End,blog-post,Other/Mixed,en,2026-03-23,2026-03-23,y
https://benefitsusa.org/en/blog/childcare-assistance-2026-ccdf-block-grant,Childcare Assistance Funding Crisis: CCDF Block Grant and State Programs,blog-post,Childcare,en,2026-04-05,2026-04-05,y
https://benefitsusa.org/en/blog/childcare-assistance-income-limits-by-state,Childcare Assistance (CCDF) Income Limits and Copays by State,blog-post,Childcare,en,2026-03-04,2026-03-04,y
https://benefitsusa.org/en/blog/children-giving-money-parent-ssi,How Receiving an Allowance from Adult Children Affects Benefits,blog-post,SSDI/Disability,en,2026-04-06,2026-04-06,y
https://benefitsusa.org/en/blog/chip-income-limits-2026,CHIP Income Limits 2026: Can My Child Qualify?,blog-post,Medicaid,en,2026-04-17,2026-04-17,y
https://benefitsusa.org/en/blog/chip-income-limits-by-state-2025,2025 CHIP Income Limits by State: Children's Health Insurance Program Eligibility,blog-post,Medicaid,en,2026-04-29,2026-04-29,y
https://benefitsusa.org/en/blog/chip-program-2026,CHIP Funding and Enrollment 2026: Children's Health Insurance Program Updates,blog-post,Medicaid,en,2026-05-10,2026-05-10,y
https://benefitsusa.org/en/blog/chip-vs-private-insurance,State Children's Health Insurance vs Private Family Plans,blog-post,Medicaid,en,2026-04-09,2026-04-09,y
https://benefitsusa.org/en/blog/clergy-government-benefits,Government Benefits for Clergy and Religious Workers,blog-post,Other/Mixed,en,2026-04-07,2026-04-07,y
https://benefitsusa.org/en/blog/coal-miner-benefits,Government Benefits for Coal Miners and Former Mining Workers,blog-post,Other/Mixed,en,2026-05-04,2026-05-04,y
