url,title,page_type,topic_bucket,lang,blog_date,sitemap_lastmod,has_es
https://benefitsusa.org/es/blog/how-to-apply-for-snap-in-pennsylvania,Cómo solicitar SNAP en Pennsylvania: una guía completa para 2026,blog-post,SNAP,es,2026-03-11,2026-03-11,
https://benefitsusa.org/es/blog/how-to-apply-for-snap-in-rhode-island,Cómo solicitar SNAP en Rhode Island,blog-post,SNAP,es,2026-04-10,2026-04-10,
https://benefitsusa.org/es/blog/how-to-apply-for-snap-in-south-carolina,Cómo solicitar SNAP en South Carolina,blog-post,SNAP,es,2026-04-10,2026-04-10,
https://benefitsusa.org/es/blog/how-to-apply-for-snap-in-south-dakota,Cómo solicitar SNAP en South Dakota,blog-post,SNAP,es,2026-04-10,2026-04-10,
https://benefitsusa.org/es/blog/how-to-apply-for-snap-in-tennessee,Cómo solicitar SNAP en Tennessee,blog-post,SNAP,es,2026-04-10,2026-04-10,
https://benefitsusa.org/es/blog/how-to-apply-for-snap-in-texas,Cómo solicitar SNAP en Texas,blog-post,SNAP,es,2026-02-05,2026-02-05,
https://benefitsusa.org/es/blog/how-to-apply-for-snap-in-utah,Cómo solicitar SNAP en Utah,blog-post,SNAP,es,2026-04-10,2026-04-10,
https://benefitsusa.org/es/blog/how-to-apply-for-snap-in-vermont,Cómo Solicitar SNAP en Vermont,blog-post,SNAP,es,2026-04-11,2026-04-11,
https://benefitsusa.org/es/blog/how-to-apply-for-snap-in-virginia,Cómo Solicitar SNAP en Virginia,blog-post,SNAP,es,2026-04-04,2026-04-04,
https://benefitsusa.org/es/blog/how-to-apply-for-snap-in-washington,Cómo Solicitar SNAP en Washington,blog-post,SNAP,es,2026-04-11,2026-04-11,
https://benefitsusa.org/es/blog/how-to-apply-for-snap-in-west-virginia,Cómo Solicitar SNAP en Virginia Occidental,blog-post,SNAP,es,2026-04-11,2026-04-11,
https://benefitsusa.org/es/blog/how-to-apply-for-snap-in-wisconsin,Cómo Solicitar SNAP en Wisconsin,blog-post,SNAP,es,2026-04-11,2026-04-11,
https://benefitsusa.org/es/blog/how-to-apply-for-snap-in-wyoming,Cómo Solicitar SNAP en Wyoming,blog-post,SNAP,es,2026-04-11,2026-04-11,
https://benefitsusa.org/es/blog/how-to-apply-for-ssdi,Cómo solicitar SSDI: Guía paso a paso 2026,blog-post,SSDI/Disability,es,2026-02-10,2026-02-10,
https://benefitsusa.org/es/blog/how-to-apply-for-ssi,Cómo solicitar SSI: Guía completa 2026,blog-post,SSDI/Disability,es,2026-02-08,2026-02-08,
https://benefitsusa.org/es/blog/how-to-apply-for-ssi-online,Cómo solicitar SSI en línea: Guía paso a paso para 2026,blog-post,SSDI/Disability,es,2026-02-22,2026-02-22,
https://benefitsusa.org/es/blog/how-to-apply-section-8-alabama,Cómo solicitar Sección 8 en Alabama (Guía 2026),blog-post,Housing,es,2026-03-12,2026-03-12,
https://benefitsusa.org/es/blog/how-to-apply-section-8-alaska,Cómo solicitar la Sección 8 en Alaska: Una guía completa sobre los Vales de Elección de Vivienda,blog-post,Housing,es,2026-03-12,2026-03-12,
https://benefitsusa.org/es/blog/how-to-apply-section-8-california,Cómo solicitar la Sección 8 en California: Guía completa (2026),blog-post,Housing,es,2026-03-12,2026-03-12,
https://benefitsusa.org/es/blog/how-to-apply-section-8-florida,Cómo Solicitar Sección 8 en Florida: Una Guía Completa,blog-post,Housing,es,2026-03-12,2026-03-12,
https://benefitsusa.org/es/blog/how-to-apply-section-8-maine,Cómo Solicitar Sección 8 en Maine: Una Guía Completa para Vales de Elección de Vivienda,blog-post,Housing,es,2026-03-17,2026-03-17,
https://benefitsusa.org/es/blog/how-to-apply-section-8-maryland,Cómo solicitar la Sección 8 en Maryland: Una guía completa paso a paso,blog-post,Housing,es,2026-03-17,2026-03-17,
https://benefitsusa.org/es/blog/how-to-apply-section-8-massachusetts,Cómo solicitar la Sección 8 en Massachusetts: Guía completa para 2026,blog-post,Housing,es,2026-03-17,2026-03-17,
https://benefitsusa.org/es/blog/how-to-apply-section-8-minnesota,Cómo solicitar Sección 8 en Minnesota: Una Guía Paso a Paso Completa,blog-post,Housing,es,2026-03-17,2026-03-17,
https://benefitsusa.org/es/blog/how-to-apply-section-8-mississippi,Cómo Solicitar la Sección 8 en Mississippi: Una Guía Completa Paso a Paso,blog-post,Housing,es,2026-03-17,2026-03-17,
https://benefitsusa.org/es/blog/how-to-apply-section-8-new-jersey,Cómo Solicitar la Sección 8 en Nueva Jersey: Guía Completa para 2025,blog-post,Housing,es,2026-03-19,2026-03-19,
https://benefitsusa.org/es/blog/how-to-apply-section-8-new-mexico,Cómo solicitar la Sección 8 en Nuevo México: Una Guía Completa para los Vales de Elección de Vivienda,blog-post,Housing,es,2026-03-12,2026-03-12,
https://benefitsusa.org/es/blog/how-to-apply-section-8-north-dakota,Cómo solicitar la Sección 8 en Dakota del Norte: Guía Completa (2025),blog-post,Housing,es,2026-03-19,2026-03-19,
https://benefitsusa.org/es/blog/how-to-apply-section-8-oklahoma,Cómo Solicitar la Sección 8 en Oklahoma: Guía Completa para 2025,blog-post,Housing,es,2026-03-19,2026-03-19,
https://benefitsusa.org/es/blog/how-to-apply-section-8-oregon,Cómo Solicitar la Sección 8 en Oregón: Guía Completa para Vales de Elección de Vivienda,blog-post,Housing,es,2026-03-19,2026-03-19,
https://benefitsusa.org/es/blog/how-to-apply-section-8-rhode-island,Cómo Solicitar la Sección 8 en Rhode Island: Guía Completa para 2025,blog-post,Housing,es,2026-03-19,2026-03-19,
https://benefitsusa.org/es/blog/how-to-choose-a-medicaid-health-plan,Cómo Elegir un Plan de Salud de Medicaid,blog-post,Medicaid,es,2026-04-14,2026-04-14,
https://benefitsusa.org/es/blog/how-to-reopen-closed-benefits-case,"Cómo volver a abrir un caso de beneficios cerrado: SNAP, Medicaid y más",blog-post,Medicaid,es,2026-03-06,2026-03-06,
https://benefitsusa.org/es/blog/how-to-use-211,Cómo Usar 211 para Encontrar Todos los Beneficios en Su Área,blog-post,Other/Mixed,es,2026-03-02,2026-03-02,
https://benefitsusa.org/es/blog/hud-vs-usda-housing-assistance-urban-rural,Asistencia de Vivienda HUD vs USDA Rural: Opciones Urbanas y Rurales en 2026,blog-post,Housing,es,2026-04-07,2026-04-07,
https://benefitsusa.org/es/blog/idaho-aca-benefits-and-coverage,Guía Completa de Beneficios y Cobertura del ACA en Idaho 2026,blog-post,ACA,es,2026-02-17,2026-02-17,
https://benefitsusa.org/es/blog/idaho-aca-eligibility-2026,"Elegibilidad para el ACA en Idaho 2026: Límites de Ingresos, Subsidios y Cómo Inscribirse",blog-post,ACA,es,2026-03-29,2026-03-29,
https://benefitsusa.org/es/blog/idaho-medicaid-eligibility-2026,"Elegibilidad de Medicaid en Idaho 2026: Límites de Ingresos, Requisitos y Cómo Solicitar",blog-post,Medicaid,es,2026-02-28,2026-02-28,
https://benefitsusa.org/es/blog/idaho-medicaid-income-limits-2026,Límites de ingresos de Medicaid en Idaho 2026,blog-post,Medicaid,es,2026-05-05,2026-05-05,
https://benefitsusa.org/es/blog/idaho-snap-eligibility-2026,Elegibilidad de SNAP en Idaho 2026,blog-post,SNAP,es,2026-04-27,2026-04-27,
https://benefitsusa.org/es/blog/illinois-aca-benefits-and-coverage,Beneficios y cobertura de ACA en Illinois: Guía 2026,blog-post,ACA,es,2026-02-13,2026-02-13,
https://benefitsusa.org/es/blog/illinois-aca-eligibility-2026,"Elegibilidad del ACA en Illinois 2026: Límites de Ingresos, Subsidios y Cómo Inscribirse",blog-post,ACA,es,2026-03-25,2026-03-25,
https://benefitsusa.org/es/blog/illinois-ebt-deposit-schedule-2026,Calendario de Depósitos EBT de Illinois 2026: Cuándo Se Cargan los Beneficios de SNAP,blog-post,SNAP,es,2026-04-19,2026-04-19,
https://benefitsusa.org/es/blog/illinois-medicaid-eligibility-2026,Elegibilidad para Medicaid en Illinois 2026: Guía de límites de ingresos,blog-post,Medicaid,es,2026-02-05,2026-02-05,
https://benefitsusa.org/es/blog/illinois-section-8-eligibility-2026,Elegibilidad para la Sección 8 en Illinois 2026,blog-post,Housing,es,2026-05-15,2026-05-15,
https://benefitsusa.org/es/blog/illinois-snap-eligibility-2026,Elegibilidad para SNAP en Illinois 2026,blog-post,SNAP,es,2026-04-24,2026-04-24,
https://benefitsusa.org/es/blog/immigration-status-benefits-2026-changes,Estado de Inmigración y Beneficios 2026: Nuevos Requisitos de Verificación y Restricciones,blog-post,Other/Mixed,es,2026-04-01,2026-04-01,
https://benefitsusa.org/es/blog/income-increase-section-8-housing,Cómo Ganar Ingresos Mientras Recibe la Sección 8,blog-post,Housing,es,2026-04-28,2026-04-28,
https://benefitsusa.org/es/blog/income-limits-government-benefits,Beneficios que pierde en ciertos niveles de ingresos: La guía completa de eliminación gradual,blog-post,Tax/Income,es,2026-02-25,2026-02-25,
https://benefitsusa.org/es/blog/indiana-aca-benefits-and-coverage,Beneficios y Cobertura ACA en Indiana: Guía Completa 2026,blog-post,ACA,es,2026-02-17,2026-02-17,
https://benefitsusa.org/es/blog/indiana-aca-eligibility-2026,"Elegibilidad para ACA en Indiana 2026: Límites de Ingresos, Subsidios e Instrucciones de Inscripción",blog-post,ACA,es,2026-03-29,2026-03-29,
https://benefitsusa.org/es/blog/indiana-medicaid-eligibility-2026,"Elegibilidad de Medicaid en Indiana 2026: Límites de Ingresos, Programas y Cómo Solicitar",blog-post,Medicaid,es,2026-02-28,2026-02-28,
https://benefitsusa.org/es/blog/indiana-medicaid-income-limits-2026,Límites de ingresos de Medicaid en Indiana 2026,blog-post,Medicaid,es,2026-05-06,2026-05-06,
https://benefitsusa.org/es/blog/indiana-snap-eligibility-2026,Elegibilidad de SNAP en Indiana 2026,blog-post,SNAP,es,2026-04-27,2026-04-27,
https://benefitsusa.org/es/blog/inheritance-affect-ssi-benefits,Dinero Heredado: Cómo Afecta Sus Beneficios,blog-post,SSDI/Disability,es,2026-03-19,2026-03-19,
https://benefitsusa.org/es/blog/inheritance-trust-and-ssi,Cómo una Herencia en un Fideicomiso Afecta sus Beneficios de SSI,blog-post,SSDI/Disability,es,2026-04-03,2026-04-03,
https://benefitsusa.org/es/blog/insurance-payout-and-ssi-benefits-eligibility,Cómo Afectan los Pagos de Seguros a la Elegibilidad para Beneficios,blog-post,SSDI/Disability,es,2026-04-06,2026-04-06,
https://benefitsusa.org/es/blog/investment-property-and-ssi-eligibility,Propiedades de Inversión y Elegibilidad para Beneficios,blog-post,SSDI/Disability,es,2026-05-07,2026-05-07,
https://benefitsusa.org/es/blog/iowa-aca-benefits-and-coverage,Beneficios y cobertura del ACA en Iowa - Su guía completa para 2026,blog-post,ACA,es,2026-02-17,2026-02-17,
https://benefitsusa.org/es/blog/iowa-aca-calculator,Calculadora ACA de Iowa: Estime Su Subsidio de Seguro de Salud 2026,blog-post,ACA,es,2026-05-13,2026-05-13,
https://benefitsusa.org/es/blog/iowa-aca-eligibility-2026,"Elegibilidad del ACA en Iowa 2026: Límites de ingresos, Subsidios y Cómo inscribirse",blog-post,ACA,es,2026-03-29,2026-03-29,
https://benefitsusa.org/es/blog/iowa-medicaid-eligibility-2026,"Elegibilidad de Medicaid en Iowa 2026: Límites de ingresos, programas e instrucciones de solicitud",blog-post,Medicaid,es,2026-03-01,2026-03-01,
https://benefitsusa.org/es/blog/iowa-medicaid-income-limits-2026,Límites de ingresos de Medicaid en Iowa 2026,blog-post,Medicaid,es,2026-05-06,2026-05-06,
https://benefitsusa.org/es/blog/iowa-snap-eligibility-2026,Elegibilidad de SNAP en Iowa 2026,blog-post,SNAP,es,2026-04-27,2026-04-27,
https://benefitsusa.org/es/blog/ira-energy-rebates-2026,Reembolsos de Eficiencia Energética bajo la Ley de Reducción de la Inflación: Lanzamiento del Programa IRA de Reembolsos para el Hogar,blog-post,Other/Mixed,es,2026-04-04,2026-04-04,
https://benefitsusa.org/es/blog/ira-withdrawal-and-medicaid,Cómo los Retiros de IRA Afectan la Elegibilidad de Medicaid,blog-post,Medicaid,es,2026-03-29,2026-03-29,
https://benefitsusa.org/es/blog/is-ssdi-taxable,¿Es el SSDI Gravable? Guía Fiscal para Beneficios por Discapacidad,blog-post,SSDI/Disability,es,2026-03-23,2026-03-23,
https://benefitsusa.org/es/blog/joint-bank-accounts-benefits-eligibility,Cuentas bancarias conjuntas vs. separadas y la elegibilidad para beneficios: lo que debe saber,blog-post,Other/Mixed,es,2026-03-04,2026-03-04,
https://benefitsusa.org/es/blog/kansas-aca-benefits-and-coverage,Guía de Beneficios y Cobertura de ACA en Kansas 2026,blog-post,ACA,es,2026-02-17,2026-02-17,
https://benefitsusa.org/es/blog/kansas-aca-eligibility-2026,"Elegibilidad de ACA en Kansas 2026: Límites de Ingresos, Subsidios e Instrucciones para la Inscripción",blog-post,ACA,es,2026-03-29,2026-03-29,
https://benefitsusa.org/es/blog/kansas-medicaid-eligibility-2026,"Elegibilidad de Medicaid en Kansas 2026: Límites de Ingresos, Reglas de KanCare y Cómo Solicitar",blog-post,Medicaid,es,2026-03-01,2026-03-01,
https://benefitsusa.org/es/blog/kansas-medicaid-income-limits-2026,Límites de ingresos de Medicaid en Kansas 2026,blog-post,Medicaid,es,2026-05-06,2026-05-06,
https://benefitsusa.org/es/blog/kansas-snap-eligibility-2026,Elegibilidad de SNAP en Kansas 2026,blog-post,SNAP,es,2026-04-27,2026-04-27,
https://benefitsusa.org/es/blog/keep-benefits-when-working,Cómo conservar sus beneficios cuando comienza a trabajar,blog-post,Other/Mixed,es,2026-03-14,2026-03-14,
https://benefitsusa.org/es/blog/kentucky-aca-benefits-and-coverage,Beneficios y Cobertura del ACA en Kentucky 2026,blog-post,ACA,es,2026-02-17,2026-02-17,
https://benefitsusa.org/es/blog/kentucky-aca-eligibility-2026,"Elegibilidad del ACA en Kentucky 2026: Límites de Ingresos, Subsidios y Cómo Inscribirse a través de Kynect",blog-post,Medicaid,es,2026-03-30,2026-03-30,
https://benefitsusa.org/es/blog/kentucky-medicaid-eligibility-2026,"Elegibilidad de Medicaid en Kentucky 2026: Límites de Ingresos, Cómo Solicitar y Quién Califica",blog-post,Medicaid,es,2026-03-01,2026-03-01,
https://benefitsusa.org/es/blog/kentucky-medicaid-income-limits-2026,Límites de ingresos de Medicaid en Kentucky 2026,blog-post,Medicaid,es,2026-05-06,2026-05-06,
https://benefitsusa.org/es/blog/kentucky-snap-eligibility-2026,Elegibilidad para SNAP en Kentucky 2026,blog-post,SNAP,es,2026-04-28,2026-04-28,
https://benefitsusa.org/es/blog/kinship-caregiver-benefits,Beneficios del gobierno para cuidadores familiares (parientes que no son los padres),blog-post,Other/Mixed,es,2026-03-04,2026-03-04,
https://benefitsusa.org/es/blog/laid-off-over-50-benefits,Quedarse sin Trabajo Después de los 50: Beneficios para Trabajadores Mayores,blog-post,Other/Mixed,es,2026-04-26,2026-04-26,
https://benefitsusa.org/es/blog/leaving-abusive-family-at-18-help,"Salir de una Familia Abusiva a los 18: Beneficios, Recursos y Planificación de Seguridad",blog-post,Other/Mixed,es,2026-03-07,2026-03-07,
https://benefitsusa.org/es/blog/lgbtq-government-benefits,Beneficios del Gobierno para Personas LGBTQ+,blog-post,Other/Mixed,es,2026-04-19,2026-04-19,
https://benefitsusa.org/es/blog/life-insurance-asset-ssi-benefits-eligibility,Cómo las Pólizas de Seguro de Vida Afectan la Elegibilidad para Beneficios,blog-post,SSDI/Disability,es,2026-04-09,2026-04-09,
https://benefitsusa.org/es/blog/lifeline-program-2026,Programa Lifeline 2026: Conectividad Asequible Después del Fin del ACP,blog-post,Other/Mixed,es,2026-02-21,2026-02-21,
https://benefitsusa.org/es/blog/lifeline-vs-acp-replacement-2026,Lifeline vs Reemplazo del ACP: Programas de Asistencia para Telefonía e Internet en 2026,blog-post,Other/Mixed,es,2026-03-17,2026-03-17,
https://benefitsusa.org/es/blog/liheap-and-food-stamps,Cómo la asistencia energética (LIHEAP) interactúa con otros beneficios,blog-post,SNAP,es,2026-05-02,2026-05-02,
https://benefitsusa.org/es/blog/liheap-by-state-2026,LIHEAP por Estado 2026: Desglose Completo de Financiamiento y Cómo Solicitar,blog-post,Housing,es,2026-03-05,2026-03-05,
https://benefitsusa.org/es/blog/liheap-funding-cuts-2026,Recortes al financiamiento de LIHEAP 2026: Impacto en la asistencia de energía para hogares de bajos ingresos,blog-post,Housing,es,2026-02-22,2026-02-22,
https://benefitsusa.org/es/blog/liheap-income-limits-by-state-2025,Elegibilidad de ingresos LIHEAP y montos de beneficios por estado en 2025,blog-post,Housing,es,2026-03-25,2026-03-25,
https://benefitsusa.org/es/blog/liheap-utilities-included-in-rent,¿Puede obtener LIHEAP si no paga directamente los servicios?,blog-post,Housing,es,2026-03-10,2026-03-10,
https://benefitsusa.org/es/blog/liheap-vs-weatherization,LIHEAP vs WAP: Asistencia de Energía vs Climatización Comparadas (2026),blog-post,Housing,es,2026-04-16,2026-04-16,
https://benefitsusa.org/es/blog/list-of-all-government-benefits-programs,La lista completa de beneficios del gobierno: más de 25 programas para verificar,blog-post,Other/Mixed,es,2026-05-01,2026-05-01,
https://benefitsusa.org/es/blog/living-together-and-food-stamps,Vivir Juntos y Cupones de Alimentos: Cómo la Convivencia Afecta Sus Beneficios de SNAP,blog-post,SNAP,es,2026-02-25,2026-02-25,
https://benefitsusa.org/es/blog/living-with-someone-affects-benefits,Qué sucede con sus beneficios cuando se muda con otra persona,blog-post,Other/Mixed,es,2026-03-17,2026-03-17,
https://benefitsusa.org/es/blog/long-term-disability-and-ssdi,Seguro de Incapacidad a Largo Plazo y SSDI: Cómo Funcionan Juntos,blog-post,SSDI/Disability,es,2026-04-16,2026-04-16,
https://benefitsusa.org/es/blog/lost-health-insurance-what-are-my-options,Pérdida de seguro médico: opciones de emergencia y cobertura gratuita,blog-post,Health/General,es,2026-04-21,2026-04-21,
https://benefitsusa.org/es/blog/lost-job-what-benefits-can-i-get,Cómo Solicitar Beneficios Después de Perder Su Trabajo,blog-post,Other/Mixed,es,2026-05-13,2026-05-13,
https://benefitsusa.org/es/blog/lost-snap-benefits-how-to-reapply,Perdió sus beneficios del SNAP: Cómo solicitar nuevamente o apelar,blog-post,SNAP,es,2026-03-13,2026-03-13,
https://benefitsusa.org/es/blog/lottery-winnings-affect-benefits,Ganar la lotería o un gran ingreso inesperado: impacto en los beneficios,blog-post,Other/Mixed,es,2026-05-05,2026-05-05,
https://benefitsusa.org/es/blog/lottery-winnings-medicaid-eligibility,¿Afectan las ganancias de lotería su elegibilidad para Medicaid?,blog-post,Medicaid,es,2026-03-19,2026-03-19,
https://benefitsusa.org/es/blog/louisiana-aca-benefits-and-coverage,Beneficios y cobertura del ACA en Luisiana: Guía completa 2025,blog-post,ACA,es,2026-02-18,2026-02-18,
https://benefitsusa.org/es/blog/louisiana-aca-calculator,Calculadora ACA de Louisiana: Estime Sus Subsidios de Seguro de Salud 2026,blog-post,ACA,es,2026-05-13,2026-05-13,
https://benefitsusa.org/es/blog/louisiana-aca-eligibility-2026,"Elegibilidad del ACA en Luisiana 2026: Límites de Ingresos, Subsidios y Cómo Inscribirse",blog-post,ACA,es,2026-03-30,2026-03-30,
https://benefitsusa.org/es/blog/louisiana-medicaid-eligibility-2026,"Elegibilidad de Medicaid en Luisiana 2026: Límites de Ingresos, Programas y Cómo Solicitar",blog-post,Medicaid,es,2026-03-01,2026-03-01,
https://benefitsusa.org/es/blog/louisiana-medicaid-income-limits-2026,Límites de ingresos de Medicaid en Louisiana 2026,blog-post,Medicaid,es,2026-05-06,2026-05-06,
https://benefitsusa.org/es/blog/louisiana-snap-eligibility-2026,Elegibilidad para SNAP en Louisiana 2026,blog-post,SNAP,es,2026-04-28,2026-04-28,
https://benefitsusa.org/es/blog/maine-aca-benefits-and-coverage,Beneficios y Cobertura del ACA en Maine: Su Guía Completa para Seguros de Salud Asequibles,blog-post,ACA,es,2026-02-18,2026-02-18,
https://benefitsusa.org/es/blog/maine-aca-eligibility-2026,"Elegibilidad para ACA en Maine 2026: Límites de Ingresos, Subsidios y Cómo Inscribirse",blog-post,ACA,es,2026-03-30,2026-03-30,
https://benefitsusa.org/es/blog/maine-medicaid-eligibility-2026,"Elegibilidad del Medicaid de Maine en 2026: Límites de ingresos de MaineCare, requisitos y cómo solicitar",blog-post,Medicaid,es,2026-03-01,2026-03-01,
https://benefitsusa.org/es/blog/maine-medicaid-income-limits-2026,Límites de Ingresos de Medicaid en Maine 2026,blog-post,Medicaid,es,2026-05-07,2026-05-07,
https://benefitsusa.org/es/blog/maine-snap-eligibility-2026,Elegibilidad para SNAP en Maine 2026,blog-post,SNAP,es,2026-04-28,2026-04-28,
https://benefitsusa.org/es/blog/maryland-aca-benefits-and-coverage,Beneficios y Cobertura de ACA en Maryland,blog-post,ACA,es,2026-02-18,2026-02-18,
https://benefitsusa.org/es/blog/maryland-aca-eligibility-2026,"Elegibilidad de ACA en Maryland 2026: Límites de Ingresos, Subsidios y Cómo Inscribirse",blog-post,ACA,es,2026-03-30,2026-03-30,
https://benefitsusa.org/es/blog/maryland-medicaid-eligibility-2026,"Elegibilidad de Medicaid en Maryland 2026: Límites de Ingresos, Cómo Solicitar y Todo lo Que Debe Saber",blog-post,Medicaid,es,2026-03-02,2026-03-02,
https://benefitsusa.org/es/blog/maryland-medicaid-income-limits-2026,Límites de Ingresos de Medicaid en Maryland 2026,blog-post,Medicaid,es,2026-05-07,2026-05-07,
https://benefitsusa.org/es/blog/maryland-snap-eligibility-2026,Elegibilidad para SNAP en Maryland 2026,blog-post,SNAP,es,2026-04-28,2026-04-28,
https://benefitsusa.org/es/blog/mass-shooting-victim-benefits,Beneficios para Víctimas de Tiroteos Masivos: Asistencia Financiera y Programas de Apoyo,blog-post,Other/Mixed,es,2026-02-27,2026-02-27,
https://benefitsusa.org/es/blog/massachusetts-aca-benefits-and-coverage,Beneficios y Cobertura de ACA en Massachusetts: Guía Completa de 2026 para Planes Health Connector,blog-post,ACA,es,2026-02-18,2026-02-18,
https://benefitsusa.org/es/blog/massachusetts-aca-calculator,Calculadora ACA de Massachusetts: Estime Su Subsidio de Seguro de Salud,blog-post,ACA,es,2026-05-13,2026-05-13,
https://benefitsusa.org/es/blog/massachusetts-aca-eligibility-2026,"Elegibilidad para el ACA en Massachusetts 2026: Límites de Ingresos, ConnectorCare y Cómo Inscribirse",blog-post,ACA,es,2026-03-23,2026-03-23,
https://benefitsusa.org/es/blog/massachusetts-medicaid-eligibility-2026,"Elegibilidad para Medicaid de Massachusetts 2026: Límites de Ingresos, Requisitos y Cómo Solicitar MassHealth",blog-post,Medicaid,es,2026-02-27,2026-02-27,
https://benefitsusa.org/es/blog/massachusetts-medicaid-income-limits-2026,Límites de Ingresos de MassHealth (Medicaid de Massachusetts) 2026,blog-post,Medicaid,es,2026-05-07,2026-05-07,
https://benefitsusa.org/es/blog/massachusetts-snap-eligibility-2026,Elegibilidad para SNAP en Massachusetts 2026,blog-post,SNAP,es,2026-04-28,2026-04-28,
https://benefitsusa.org/es/blog/maternity-leave-and-food-stamps,Licencia por Maternidad y Cupones de Alimentos: Cómo Obtener Beneficios de SNAP Durante la Licencia Parental,blog-post,SNAP,es,2026-03-07,2026-03-07,
https://benefitsusa.org/es/blog/medicaid-and-snap-at-same-time,Medicaid y SNAP Juntos: Cómo Obtener Ambos y Qué Cambia en 2026,blog-post,Medicaid,es,2026-03-25,2026-03-25,
https://benefitsusa.org/es/blog/medicaid-cuts-2026,Recortes a Medicaid en la Ley One Big Beautiful Bill: Reducción de $625 mil millones explicada,blog-post,Medicaid,es,2026-02-22,2026-02-22,
https://benefitsusa.org/es/blog/medicaid-dental-coverage-2026,Cobertura Dental de Medicaid 2026: Qué Estados Están Añadiendo Beneficios Dentales para Adultos,blog-post,Medicaid,es,2026-05-07,2026-05-07,
https://benefitsusa.org/es/blog/medicaid-estate-recovery-2026,Cambios en las Reglas de Recuperación Patrimonial de Medicaid: Protección de Activos Después de la Muerte,blog-post,Medicaid,es,2026-05-07,2026-05-07,
https://benefitsusa.org/es/blog/medicaid-income-limits-pregnant-women,Límites de Ingresos de Medicaid para Mujeres Embarazadas por Estado (2025),blog-post,Medicaid,es,2026-04-09,2026-04-09,
https://benefitsusa.org/es/blog/medicaid-myths-eligibility,Mitos sobre Medicaid: 7 Cosas Que Las Personas Entienden Mal Sobre Elegibilidad,blog-post,Medicaid,es,2026-03-17,2026-03-17,
https://benefitsusa.org/es/blog/medicaid-nursing-home-application,Cómo Solicitar Medicaid para Cuidado a Largo Plazo (Cobertura en Hogar de Ancianos),blog-post,Medicaid,es,2026-05-14,2026-05-14,
https://benefitsusa.org/es/blog/medicaid-office-locations-north-carolina,Ubicaciones de Oficinas Medicaid en Carolina del Norte: Encuentre su Oficina DSS Local,blog-post,Medicaid,es,2026-02-27,2026-02-27,
https://benefitsusa.org/es/blog/medicaid-redetermination-2026,Redeterminación de Medicaid 2026: Pérdida Continua de Cobertura y Plazos Estatales,blog-post,Medicaid,es,2026-03-02,2026-03-02,
https://benefitsusa.org/es/blog/medicaid-spend-down-vs-extra-help,Gasto reducido de Medicaid vs Ayuda Extra de Medicare Parte D: Cobertura de medicamentos para adultos mayores,blog-post,Medicare,es,2026-05-06,2026-05-06,
https://benefitsusa.org/es/blog/medicaid-vs-employer-insurance,Medicaid vs Seguro de Salud del Empleador: Cuándo la Cobertura Gratuita es Mejor,blog-post,Medicaid,es,2026-03-24,2026-03-24,
https://benefitsusa.org/es/blog/medicaid-waiver-application-hcbs,Cómo Solicitar los Servicios Domiciliarios y Comunitarios de Medicaid (HCBS),blog-post,Medicaid,es,2026-05-15,2026-05-15,
https://benefitsusa.org/es/blog/medicaid-waiver-vs-nursing-home,Programas de Exención de Medicaid vs Hogares de Ancianos: Alternativas de Atención en el Hogar,blog-post,Medicaid,es,2026-04-29,2026-04-29,
https://benefitsusa.org/es/blog/medicaid-work-requirements-2026,Requisitos de Trabajo de Medicaid 2026: Qué Estados los Están Implementando y Qué Esperar,blog-post,Medicaid,es,2026-02-21,2026-02-21,
https://benefitsusa.org/es/blog/medicare-extra-help-income-limits-2025,Límites de ingresos y activos de Medicare Extra Help (LIS) 2025,blog-post,Medicare,es,2026-05-10,2026-05-10,
https://benefitsusa.org/es/blog/medicare-part-d-vs-goodrx,Medicare Parte D vs GoodRx: Comparación de Ahorros en Medicamentos con Receta,blog-post,Medicare,es,2026-04-25,2026-04-25,
https://benefitsusa.org/es/blog/michigan-aca-benefits-and-coverage,Beneficios y cobertura de ACA en Michigan: Guía 2026,blog-post,ACA,es,2026-02-13,2026-02-13,
https://benefitsusa.org/es/blog/michigan-aca-eligibility-2026,"Elegibilidad para ACA en Michigan 2026: Límites de Ingresos, Subsidios e Instrucciones para la Inscripción",blog-post,ACA,es,2026-03-25,2026-03-25,
https://benefitsusa.org/es/blog/michigan-ebt-deposit-schedule-2026,Calendario de Depósitos EBT de Michigan 2026: Cuándo Se Cargan los Beneficios SNAP,blog-post,SNAP,es,2026-04-20,2026-04-20,
